EDU_1;EDU_2;Relation
Предлагаю вам взглянуть на увлажняющий крем крем от корейского бренда Klairs.;Всё, что пробовала;preparation_r
Бренд Dear, Klairs у меня на данный момент в любимчиках.;Предлагаю вам взглянуть на увлажняющий крем крем от корейского бренда Klairs.;evaluation_r
Всё, что пробовала;следовательно в составе нет отдушек, красителей, спирта, и других непонятных вещей.;evaluation_r
(а я всё пробовала),;Всё, что пробовала;contrast_m
не вызывает удивленного поднятия брови,;Всё, что пробовала;same-unit_m
как это обычно бывает с корейскими брендами,;не вызывает удивленного поднятия брови,;background_r
когда в стоге сена нужно отыскать иголку.;как это обычно бывает с корейскими брендами,;evaluation_r
Добротный бренд, который специализируется на уходе за чувствительной кожей,;следовательно в составе нет отдушек, красителей, спирта, и других непонятных вещей.;evidence_r
Не тестируется на животных.;следовательно в составе нет отдушек, красителей, спирта, и других непонятных вещей.;elaboration_r
Ценник невысокий,;следовательно в составе нет отдушек, красителей, спирта, и других непонятных вещей.;elaboration_r
а качество отличное.;Ценник невысокий,;contrast_m
Раньше они выпускали свои кремы в банках,;Тюбик объёмом 60 мл.;preparation_r
сейчас перешли на тюбики,;Раньше они выпускали свои кремы в банках,;sequence_m
что намного лучше в плане безопасности крема.;сейчас перешли на тюбики,;evaluation_r
Упаковка не очень удобная,;Тюбик объёмом 60 мл.;evaluation_r
мне, наверное, придется разрезать тубу,;Упаковка не очень удобная,;cause_r
чтобы извлечь остатки крема.;мне, наверное, придется разрезать тубу,;purpose_r
Если бы пробка была меньшего размера,;это упростило бы процесс извлечения остатков.;condition_r
это упростило бы процесс извлечения остатков.;Упаковка не очень удобная,;contrast_m
Имеет ненавязчивый травянистый запах.;Тюбик объёмом 60 мл.;elaboration_r
Текстура плотная,;Имеет ненавязчивый травянистый запах.;joint_m
но быстро и легко распределяется.;Текстура плотная,;contrast_m
Следов не оставляет,;Имеет ненавязчивый травянистый запах.;joint_m
не жирнит,;Следов не оставляет,;joint_m
но с косметикой может скатываться,;не жирнит,;contrast_m
да и сама косметика долго на нем не живёт,;поэтому я его перевела в вечерние.;cause_r
поэтому я его перевела в вечерние.;но с косметикой может скатываться,;joint_m
Многие пишут, что после нанесения крема кожа аж светится изнутри, ах, ох!;Имеет ненавязчивый травянистый запах.;evaluation_r
— это шиммер.;Многие пишут, что после нанесения крема кожа аж светится изнутри, ах, ох!;contrast_m
Это шиммер.;Поэтому я снижу немного оценку,;cause_r
Поэтому я снижу немного оценку,;зачем мне шиммер вечером?;cause_r
зачем мне шиммер вечером?;— это шиммер.;evaluation_r
Хотя они позиционируют этот крем как дневной для всех типов кожи,;мне больше кажется, что он подойдет для сухой и нормальной как дневной крем, для комби и жирной — как ночной.;concession_r
мне больше кажется, что он подойдет для сухой и нормальной как дневной крем, для комби и жирной — как ночной.;зачем мне шиммер вечером?;elaboration_r
В составе бета-глюкан, церамиды, экстракты аниса, алоэ, грейпфрута, папайи, индийского лотоса, пиона, рапса, шлемника байкальского, эвкалипта, сельдерея, моркови, томатов, капусты, брокколи, риса, портулака, пеларгонии, масло ши, жожоба, лаванды, цитрусов.;Многие пишут, что после нанесения крема кожа аж светится изнутри, ах, ох!;elaboration_r
Действием крема я довольна,;Производитель оправдал мои ожидания.;preparation_r
хороший вариант на холодное время года;Действием крема я довольна,;joint_m
— он дает ощутимое увлажнение и питание.;хороший вариант на холодное время года;cause_r
Покупала именно с прицелом на зиму,;Производитель оправдал мои ожидания.;solutionhood_r
ждала хорошего качественного увлажнения.;Покупала именно с прицелом на зиму,;joint_m
Пользуюсь на ночь, не каждый день,;Производитель оправдал мои ожидания.;background_r
но надо уже его добить,;Пользуюсь на ночь, не каждый день,;contrast_m
скоро зима закончится.;но надо уже его добить,;cause_r
Крем достойный внимания и покупки.;Пользуюсь на ночь, не каждый день,;evaluation_r