EDU_1;EDU_2;Relation
Люблю такие расклады.;«По состоянию на конец прошлого года отношение корпоративной задолженности к валовому внутреннему продукту США, согласно данным Федеральной резервной системы, достигло 73,1%,;preparation_r
Когда все новости из разных точек приходят почти одновременно,;Люблю такие расклады.;elaboration_r
и все отображают реальную ситуацию в каждой из точек.;Когда все новости из разных точек приходят почти одновременно,;joint_m
Из США вещают Wall Street Journal:;«По состоянию на конец прошлого года отношение корпоративной задолженности к валовому внутреннему продукту США, согласно данным Федеральной резервной системы, достигло 73,1%,;attribution_r
что немного ниже максимального показателя в 73,7%, установленного в 2009 году.;«По состоянию на конец прошлого года отношение корпоративной задолженности к валовому внутреннему продукту США, согласно данным Федеральной резервной системы, достигло 73,1%,;comparison_m
Между тем сумма американского корпоративного долга с кредитным рейтингом BBB – то есть самой низкой категории кредитов инвестиционного уровня – более чем удвоилась с момента прошлого кризиса».;«По состоянию на конец прошлого года отношение корпоративной задолженности к валовому внутреннему продукту США, согласно данным Федеральной резервной системы, достигло 73,1%,;comparison_m
Одновременно глава ФРС Джером Пауэлл заявляет,;что «Федеральный резерв готов отреагировать на торговые войны, которые ведёт Трамп,;attribution_r
и готов снижать базовую учётную ставку».;что «Федеральный резерв готов отреагировать на торговые войны, которые ведёт Трамп,;joint_m
Причём текущая ставка находится в диапазоне 2,25-2,5%,;поэтому манёвр;cause_r
поэтому манёвр;что «Федеральный резерв готов отреагировать на торговые войны, которые ведёт Трамп,;joint_m
для снижения и стимулирования;поэтому манёвр;purpose_r
таким образом роста экономики существенно ограничен.;поэтому манёвр;evaluation_r
Фактически Пауэлл констатирует наличие рецессии в США.;поэтому манёвр;evaluation_r
При этом примерно четверть американцев берут кредиты;что «Федеральный резерв готов отреагировать на торговые войны, которые ведёт Трамп,;joint_m
для покупки еды.;При этом примерно четверть американцев берут кредиты;purpose_r
Не покупки домов,;При этом примерно четверть американцев берут кредиты;elaboration_r
не приобретения автомобиля,;Не покупки домов,;joint_m
не оплаты образования –;Не покупки домов,;joint_m
еды.;Не покупки домов,;contrast_m
Это к вопросу, «как хорошо там,;При этом примерно четверть американцев берут кредиты;evaluation_r
где нас нет».;Это к вопросу, «как хорошо там,;condition_r
когда Трамп вводит пошлины;И в это же время,;background_r
и ведёт торговые войны против Китая, ЕС и даже Мексики,;когда Трамп вводит пошлины;joint_m
в Петербурге проходит очередной международный экономический форум.;И в это же время,;same-unit_m
Где крупнейшие мировые корпорации;И в это же время,;elaboration_r
(я не преувеличиваю,;Где крупнейшие мировые корпорации;evaluation_r
можете сами посмотреть список участников);(я не преувеличиваю,;evidence_r
выстраиваются в очередь,;Где крупнейшие мировые корпорации;same-unit_m
чтобы иметь возможность торговать;Где крупнейшие мировые корпорации;purpose_r
и сотрудничать с «порванной и изолированной» Россией.;чтобы иметь возможность торговать;joint_m
(в визите принимает участие китайское правительство почти в полном составе).;И одновременно с этим в Москве проходит встреча президента России Владимира Путина и главы Китая Си Цзиньпина;elaboration_r
Восьмой визит председателя Си в Россию с момента вступления в должность и тридцатая его встреча с Путиным.;И одновременно с этим в Москве проходит встреча президента России Владимира Путина и главы Китая Си Цзиньпина;elaboration_r
На которой на самом высоком уровне подписали целый ряд важных стратегических соглашений.;И одновременно с этим в Москве проходит встреча президента России Владимира Путина и главы Китая Си Цзиньпина;elaboration_r
Из ключевого:;И одновременно с этим в Москве проходит встреча президента России Владимира Путина и главы Китая Си Цзиньпина;elaboration_r
— Россия теперь будет поставлять в Китай сою (вместо США);Из ключевого:;elaboration_r
— Россия теперь будет поставлять в Китай пшеницу (вместо США);— Россия теперь будет поставлять в Китай сою (вместо США);joint_m
— Россия будет поставлять в Китай больше СПГ (вместо США);— Россия теперь будет поставлять в Китай сою (вместо США);joint_m
— Россия уже начала поставлять в Китай молоко (список аккредитованных компаний увеличили до 33),;— Россия теперь будет поставлять в Китай сою (вместо США);joint_m
готовятся поставлять сухое молоко и сыворотку;— Россия уже начала поставлять в Китай молоко (список аккредитованных компаний увеличили до 33),;joint_m
— «Хуавэй» подписал договор с «МТС»;— Россия теперь будет поставлять в Китай сою (вместо США);joint_m
(тот самый «Хуавэй», которого США изо всех сил пытаются задавить);— «Хуавэй» подписал договор с «МТС»;contrast_m
— «Алибаба» подписал договор с «Мейл.ру»;— Россия теперь будет поставлять в Китай сою (вместо США);joint_m
— русские будут строить ещё два блока на китайской АЭС;— Россия теперь будет поставлять в Китай сою (вместо США);joint_m
— ещё несколько совместных проектов, как в России, так и в Китае.;— Россия теперь будет поставлять в Китай сою (вместо США);joint_m
Председатель Си назвал Путина «самым близким иностранным коллегой и самым лучшим другом».;Путин не остался в долгу.;cause_r
Путин не остался в долгу.;Раньше считалось, что самый страшный сон англосаксов – это союз России и Германии.;solutionhood_r
Я не помню, они уже пили на брудершафт?;Путин не остался в долгу.;evaluation_r
Оказалось, что это союз России и Китая.;Раньше считалось, что самый страшный сон англосаксов – это союз России и Германии.;contrast_m
Картина маслом.;Раньше считалось, что самый страшный сон англосаксов – это союз России и Германии.;evaluation_r
для торговли с Китаем.;P.S. В Хасанском районе «Яблоко», остатки «Открытой России» и прочие грантоеды из последних сил пытаются помешать строительству СПГ-терминала;purpose_r
Кому это выгодно, думаю, объяснять не надо.;P.S. В Хасанском районе «Яблоко», остатки «Открытой России» и прочие грантоеды из последних сил пытаются помешать строительству СПГ-терминала;evaluation_r
И, конечно, нужно срочно, кровь из носу, пролетарскую революцию в России (со специально обученными на деньги Ходорковского нигде не работающими «профессиональными пролетариями» во главе).;P.S. В Хасанском районе «Яблоко», остатки «Открытой России» и прочие грантоеды из последних сил пытаются помешать строительству СПГ-терминала;contrast_m
Иначе гегемон долго не продержится!;И, конечно, нужно срочно, кровь из носу, пролетарскую революцию в России (со специально обученными на деньги Ходорковского нигде не работающими «профессиональными пролетариями» во главе).;contrast_m