EDU_1;EDU_2;Relation
Итак, Монголия. Сначала и не думала заворачивать в эту страну.;Решили ехать на Байкал, с иркутской стороны, соответственно.;preparation_r
Потом к Байкалу плавно приплюсовали Бурятию;Решили ехать на Байкал, с иркутской стороны, соответственно.;sequence_m
(и не пожалели ни разу!),;Потом к Байкалу плавно приплюсовали Бурятию;elaboration_r
а потом я рассмотрела, что с Улан-Удэ не так далеко и до Улан-Батора!;Потом к Байкалу плавно приплюсовали Бурятию;joint_m
Не далеко — это 500 километров.;а потом я рассмотрела, что с Улан-Удэ не так далеко и до Улан-Батора!;elaboration_r
когда стала искать виды транспортировки из Улан-Удэ в Монголию,;Выбор подтвердился окончательно,;condition_r
и нашла рейс монгольских авиалиний.;когда стала искать виды транспортировки из Улан-Удэ в Монголию,;joint_m
Летает он несколько раз в неделю.;Выбор подтвердился окончательно,;elaboration_r
Еще есть поезд, также пару раз в неделю.;Выбор подтвердился окончательно,;joint_m
Причем, цена на самолет и поезд практически одна и та же — 5000 руб., плюс/минус.;Выбор подтвердился окончательно,;cause_r
Только вот самолетом доберетесь за 1,5 часа,;Причем, цена на самолет и поезд практически одна и та же — 5000 руб., плюс/минус.;elaboration_r
а поезд плетётся 14,5 часов.;Только вот самолетом доберетесь за 1,5 часа,;comparison_m
Мы сделали так: в Улан-Батор полетели самолетом, а обратно — поездом.;Выбор подтвердился окончательно,;elaboration_r
Во-первых, так было удобнее по датам и времени,;Мы сделали так: в Улан-Батор полетели самолетом, а обратно — поездом.;cause_r
а во-вторых, ни капли не пожалели, выбрав поезд,;Во-первых, так было удобнее по датам и времени,;joint_m
потому что виды за окном были потрясающие.;а во-вторых, ни капли не пожалели, выбрав поезд,;cause_r
Монголии я побаивалась, честно сказать.;Выбор подтвердился окончательно,;joint_m
Знала о ней несколько отдалённых фактов: степи, степи, большая территория, мало жителей, большинство из которых — кочевники, лошади,;Монголии я побаивалась, честно сказать.;elaboration_r
Улан-Батор — самая холодная столица мира,;Знала о ней несколько отдалённых фактов: степи, степи, большая территория, мало жителей, большинство из которых — кочевники, лошади,;joint_m
и то, что один мой знакомый ездил туда охотиться с монголами.;Улан-Батор — самая холодная столица мира,;joint_m
С таким набором я бы, наверно, ещё долго не выбрала Монголию как объект посещения.;Знала о ней несколько отдалённых фактов: степи, степи, большая территория, мало жителей, большинство из которых — кочевники, лошади,;evaluation_r
Ещё казалось, что вот сейчас выйду из аэропорта,;Знала о ней несколько отдалённых фактов: степи, степи, большая территория, мало жителей, большинство из которых — кочевники, лошади,;joint_m
а там — коровы какие-нибудь ходят, гужевые повозки с лошадьми, монголы в национальных одеждах, ни одного магазина, и вот она, я...;Ещё казалось, что вот сейчас выйду из аэропорта,;joint_m
Но, каково было удивление, что сначала встретила в аэропорту огромную толпу туристов из Южной Кореи;Монголии я побаивалась, честно сказать.;contrast_m
(уже, думаю, не одни тут будем :),;Но, каково было удивление, что сначала встретила в аэропорту огромную толпу туристов из Южной Кореи;elaboration_r
а потом нас вёз очень даже симпатичный, модный, молодой монгол, и не на гужевой повозке, а на вполне хорошем авто.;Но, каково было удивление, что сначала встретила в аэропорту огромную толпу туристов из Южной Кореи;joint_m
Да и музыка в машине играла приятная.;а потом нас вёз очень даже симпатичный, модный, молодой монгол, и не на гужевой повозке, а на вполне хорошем авто.;elaboration_r
Аэропорт имени, конечно же, Чингисхана!;Но, каково было удивление, что сначала встретила в аэропорту огромную толпу туристов из Южной Кореи;elaboration_r
В общем — выдохнула.;Ещё больше расслабилась,;preparation_r
когда заселились в отель;Ещё больше расслабилась,;condition_r
— вот уж действительно, это вам не сибирский сервис — номер оказался просто огромный!;Ещё больше расслабилась,;evaluation_r
И воду питьевую не забыли, и все принадлежности на месте, и даже печеньки в качестве комплимента.;Ещё больше расслабилась,;joint_m
Вот, думаю, тебе и монголы!;Ещё больше расслабилась,;evaluation_r
вместе с которой мы и начали изучение страны.;В Монголии у нас была местная гид — Болор,;elaboration_r
Болор хорошо знает русский язык,;В Монголии у нас была местная гид — Болор,;elaboration_r
так как училась в школе при российском посольстве.;Болор хорошо знает русский язык,;cause_r
Хотя это, скорее, исключение.;Болор хорошо знает русский язык,;elaboration_r
Русский язык в Монголии не знают, общение с туристами — на английском либо «на пальцах».;Болор хорошо знает русский язык,;elaboration_r
Туристов, кстати, не мало. Особенно много корейцев.;Русский язык в Монголии не знают, общение с туристами — на английском либо «на пальцах».;elaboration_r
Так и не поняла с чем это связано.;Туристов, кстати, не мало. Особенно много корейцев.;evaluation_r
Очень много корейских ресторанов, кафе, и чуть ли не несколько рейсов в день прилетает из Сеула.;Туристов, кстати, не мало. Особенно много корейцев.;evidence_r
Есть туристы из Китая, но больше, так называемых, внутренних монголов.;Очень много корейских ресторанов, кафе, и чуть ли не несколько рейсов в день прилетает из Сеула.;comparison_m
Это те же самые монголы, которые живут обособленно на китайской территории, граничащей с Монголией.;Есть туристы из Китая, но больше, так называемых, внутренних монголов.;restatement_m
Естественно, китайцам такое соседство сто лет не нужно,;Есть туристы из Китая, но больше, так называемых, внутренних монголов.;elaboration_r
и притесняют несчастных всеми способами.;Естественно, китайцам такое соседство сто лет не нужно,;joint_m
Русских туристов совсем не много.;Очень много корейских ресторанов, кафе, и чуть ли не несколько рейсов в день прилетает из Сеула.;comparison_m
Видимо, это связано с очень дорогими рейсами из Москвы в Улан-Батор:;Русских туристов совсем не много.;evaluation_r
летает Аэрофлот,;Видимо, это связано с очень дорогими рейсами из Москвы в Улан-Батор:;cause_r
билет в оба конца стоит примерно 50 000 руб., а также, возможно, с отсутствием туристических программ в данную страну.;летает Аэрофлот,;joint_m
(основной религией в Монголии является тибетский буддизм);Так вот, начали мы непосредственное знакомство с Улан-Батором с ресторана с буддийского монастыря Гандан;background_r
— это крупнейший монастырь в Монголии.;Так вот, начали мы непосредственное знакомство с Улан-Батором с ресторана с буддийского монастыря Гандан;same-unit_m
Монастырь Гандан  А вот и монголы.;Так вот, начали мы непосредственное знакомство с Улан-Батором с ресторана с буддийского монастыря Гандан;elaboration_r
Идет молебен.;Внутри снимать нельзя.;cause_r
Внутри снимать нельзя.;Монастырь Гандан  А вот и монголы.;elaboration_r
Большая чаша с благовониями. Купила для себя маленькую в Бурятии,;теперь жгу дома.;cause_r
теперь жгу дома.;Монастырь Гандан  А вот и монголы.;joint_m
Сей мемориал символизирует память о поддержке Красной Армией монгольской революции и победе при Халкин-Голе.;Далее отправились на вершину Зайсан-Толгой.;elaboration_r
Вместе с тем сюда стоит подняться, главным образом,;Далее отправились на вершину Зайсан-Толгой.;joint_m
ради панорамного вида на Улан-Батор.;Вместе с тем сюда стоит подняться, главным образом,;purpose_r
Внизу хорошо видны юрты.;Вместе с тем сюда стоит подняться, главным образом,;elaboration_r
Они жилые.;Внизу хорошо видны юрты.;elaboration_r
Улан-Батор - самая холодная столица мира.;Вместе с тем сюда стоит подняться, главным образом,;elaboration_r
Среднегодовая температура –0,4 °C.;Улан-Батор - самая холодная столица мира.;joint_m
на реконструкцию;Сад Будды был, к сожалению, закрыт;purpose_r
(большая золотая статуя Будды находится именно там),;Сад Будды был, к сожалению, закрыт;purpose_r
и мы отправились во Дворец Богдо-Хана.;Сад Будды был, к сожалению, закрыт;joint_m
Атмосферное место, где можно немного прикоснуться к истории и культуре Монголии.;Сад Будды был, к сожалению, закрыт;evaluation_r
Золотой Будда.  Дворец Богдо-Хана.;Атмосферное место, где можно немного прикоснуться к истории и культуре Монголии.;elaboration_r
Её вы не упустите из вида,;Главная площадь Улан-Батора носит имя крупнейшего монгольского революционера и руководителя — Сухэ-Батора.;elaboration_r
ведь площадь просто огромная.;Её вы не упустите из вида,;cause_r
Не удивительно, что она входит в десятку самых больших площадей мира.;Её вы не упустите из вида,;evaluation_r
Есть очень милая традиция — каждые выходные на этой площади собираются одноклассники, окончившие школу,;Главная площадь Улан-Батора носит имя крупнейшего монгольского революционера и руководителя — Сухэ-Батора.;background_r
для встречи.;Есть очень милая традиция — каждые выходные на этой площади собираются одноклассники, окончившие школу,;elaboration_r
О дате встречи, конечно, договариваются заранее,;Есть очень милая традиция — каждые выходные на этой площади собираются одноклассники, окончившие школу,;elaboration_r
а место всегда одно и то же — площадь Сухэ-Батора.;О дате встречи, конечно, договариваются заранее,;contrast_m
Есть и еще одна традиция — это фото с Чингисханом.;Есть очень милая традиция — каждые выходные на этой площади собираются одноклассники, окончившие школу,;joint_m
Статуя сидящего Чингисхана тоже находится на этой площади.;Есть и еще одна традиция — это фото с Чингисханом.;elaboration_r
Площадь Сухэ-Батора.   Одноклассники);Главная площадь Улан-Батора носит имя крупнейшего монгольского революционера и руководителя — Сухэ-Батора.;elaboration_r
Я не большой любитель подобных музеев,;Побывали мы и в Национальном историческом музее.;elaboration_r
всё больше люблю изучать страну, так сказать, живьем,;Я не большой любитель подобных музеев,;cause_r
но музей оказался интересный.;Я не большой любитель подобных музеев,;contrast_m
Закончили первый день в Улан-Баторе концертом народного фольклора.;Побывали мы и в Национальном историческом музее.;sequence_m
Вот это действо, считаю, пропускать нельзя.;Закончили первый день в Улан-Баторе концертом народного фольклора.;evaluation_r
Одно выступление с горловым пением чего стоит!;Закончили первый день в Улан-Баторе концертом народного фольклора.;evaluation_r
Пожалуй, такого я не слышала, уж вживую — точно.;Одно выступление с горловым пением чего стоит!;evaluation_r
Да, на концерт советую прийти заранее,;Закончили первый день в Улан-Баторе концертом народного фольклора.;joint_m
чтобы занять хорошие места;Да, на концерт советую прийти заранее,;purpose_r
(билеты продаются без мест),;Да, на концерт советую прийти заранее,;cause_r
иначе потом вас атакуют со всех сторон корейцы;(билеты продаются без мест),;contrast_m
и придется ютиться где попало.;иначе потом вас атакуют со всех сторон корейцы;joint_m
В общем, первый день прошел на одном дыхании, класс!;Идем в корейский ресторан!;preparation_r
Идем в корейский ресторан!;Ну, а где ещё в ближайшее время попадешь в хороший корейский ресторан?;preparation_r
Сходите обязательно.;Ну, а где ещё в ближайшее время попадешь в хороший корейский ресторан?;elaboration_r
Многое есть было невозможно,;Ну, а где ещё в ближайшее время попадешь в хороший корейский ресторан?;elaboration_r
потом всё внутри, да и снаружи, горело,;Многое есть было невозможно,;cause_r
но мы сходили));Многое есть было невозможно,;contrast_m
Вечерняя площадь.  Тугрики.;Ну, а где ещё в ближайшее время попадешь в хороший корейский ресторан?;joint_m
День второй.;Улан-Батор, кстати, переводится с монгольского как Красный богатырь.;preparation_r
Улан-Батор, кстати, переводится с монгольского как Красный богатырь.;Второй день мы провели за пределами Улан-Батора.;background_r
Красиво.;Улан-Батор, кстати, переводится с монгольского как Красный богатырь.;evaluation_r
Сначала отправились к самой большой статуе Чингисхана,;Второй день мы провели за пределами Улан-Батора.;elaboration_r
она же — крупнейшая конная статуя в мире.;Сначала отправились к самой большой статуе Чингисхана,;evaluation_r
Путь к ней — примерно 60 км.;Сначала отправились к самой большой статуе Чингисхана,;elaboration_r
Статую сделали на деньги местного бизнесмена.;Путь к ней — примерно 60 км.;joint_m
Там же есть музей, магазинчики сувениров, кафешка.;Путь к ней — примерно 60 км.;joint_m
На голове лошади располагается смотровая площадка.;Путь к ней — примерно 60 км.;joint_m
Добраться туда можно на лифте,;На голове лошади располагается смотровая площадка.;elaboration_r
но советую пройтись по лестнице,;Добраться туда можно на лифте,;contrast_m
так как очень много людей;но советую пройтись по лестнице,;cause_r
и лифт ждать долго.;так как очень много людей;joint_m
Сама статуя 40 метров в высоту,;Путь к ней — примерно 60 км.;joint_m
была открыта в 2008 году.;Сама статуя 40 метров в высоту,;joint_m
Территория ещё достраивается.;Путь к ней — примерно 60 км.;joint_m
Говорят, в ближайшем будущем там появится много всего интересного — юрты для туристов, гольф-клуб, тематический парк, открытий театр и другое.;Территория ещё достраивается.;elaboration_r
Внутренние монголы. Путешествуют всегда организованными группами.  Вид сверху.;Сначала отправились к самой большой статуе Чингисхана,;elaboration_r
Далее наш путь пролегал в Национальный парк Тэрэлж.;поэтому ехала без особого воодушевления.;preparation_r
О данном парке я ранее не слышала,;поэтому ехала без особого воодушевления.;cause_r
И вновь Монголия меня удивила!;поэтому ехала без особого воодушевления.;elaboration_r
Какая красота открылась взору!;поэтому ехала без особого воодушевления.;evaluation_r
Природа Монголии — как она есть.;Какая красота открылась взору!;joint_m
Оказалось, что Монголия — это далеко не одни степи, степи.;поэтому ехала без особого воодушевления.;elaboration_r
Это и горы различных причудливых форм, и красивый ландшафт местности, и речушки, и леса и ещё много чего,;Оказалось, что Монголия — это далеко не одни степи, степи.;contrast_m
что менее чем за 4 дня увидеть не удалось(;Это и горы различных причудливых форм, и красивый ландшафт местности, и речушки, и леса и ещё много чего,;elaboration_r
Национальный парк Тэрэлж.   Гора Черепаха.;поэтому ехала без особого воодушевления.;elaboration_r
На территории парка расположено очень много туристических баз.;Национальный парк Тэрэлж.   Гора Черепаха.;joint_m
Мне особо приглянулась вот эта.;На территории парка расположено очень много туристических баз.;elaboration_r
Юрты для туристов.;В этих юртах захотелось переночевать хоть бы одну ночку!;elaboration_r
Так что, у кого будет возможность —;не упустите шанс.;condition_r
не упустите шанс.;В этих юртах захотелось переночевать хоть бы одну ночку!;elaboration_r
В том же парке Тэрэлж есть Буддийский медитационный центр Арьяабал.;В этих юртах захотелось переночевать хоть бы одну ночку!;joint_m
Подъём туда занимает минут 20-30,;В том же парке Тэрэлж есть Буддийский медитационный центр Арьяабал.;elaboration_r
но оно того стоит.;Подъём туда занимает минут 20-30,;contrast_m
