EDU_1;EDU_2;Relation
Вид сверху просто улётный.;Подъём туда занимает минут 20-30,;cause_r
Медитировать да и только!;Вид сверху просто улётный.;evaluation_r
И вообще, за эту поездку на буддийские территории нашей Бурятии и Монголии я как-то, неожиданно для себя, прониклась буддизмом.;В том же парке Тэрэлж есть Буддийский медитационный центр Арьяабал.;joint_m
Приятно это всё у них, по мне.;И вообще, за эту поездку на буддийские территории нашей Бурятии и Монголии я как-то, неожиданно для себя, прониклась буддизмом.;evaluation_r
Путь к медитации.   Жить надо высоко, душою звезд касаясь!;В том же парке Тэрэлж есть Буддийский медитационный центр Арьяабал.;elaboration_r
Причем, заход в гости был такой:;Самым колоритным местом за всю поездку считаю заход в гости к настоящей семье кочевников, в настоящую юрту. Да, не в эту красивую и ухоженную, как в парке, для туристов.;elaboration_r
Болор сказала, что любая семья кочевников обязана принять путника, который постучался к ним.;Причем, заход в гости был такой:;elaboration_r
Собственно, мы и зарулили в ближайшую юрту вдоль дороги.;Причем, заход в гости был такой:;evidence_r
Семья оказалась казахская.;Собственно, мы и зарулили в ближайшую юрту вдоль дороги.;elaboration_r
Кочевники обычно обитают в одной и той же местности,;Самым колоритным местом за всю поездку считаю заход в гости к настоящей семье кочевников, в настоящую юрту. Да, не в эту красивую и ухоженную, как в парке, для туристов.;joint_m
то есть не уходят далеко от дома.;Кочевники обычно обитают в одной и той же местности,;restatement_m
Но поговаривают, что бывают случаи непреднамеренного перехода границы кочевниками из Казахстана и Китая в Монголию и наоборот.;Кочевники обычно обитают в одной и той же местности,;contrast_m
Современные кочевники пользуются многими благами цивилизации —;Кочевники обычно обитают в одной и той же местности,;joint_m
есть у них автомобили, сотовые телефоны и т.д.;Современные кочевники пользуются многими благами цивилизации —;elaboration_r
Когда нужно переехать на другое место —;юрту быстренько складывают в багажник,;cause_r
юрту быстренько складывают в багажник,;Современные кочевники пользуются многими благами цивилизации —;elaboration_r
а на новом месте быстренько раскладывают.;юрту быстренько складывают в багажник,;joint_m
Юрты в Монголии повсюду,;юрту быстренько складывают в багажник,;elaboration_r
это очень удобное жилье для кочевников;Юрты в Монголии повсюду,;evaluation_r
в условиях здешнего климата.;это очень удобное жилье для кочевников;condition_r
В Улан-Баторе до сих пор есть целый район с юртами.;Юрты в Монголии повсюду,;elaboration_r
И как правительство не пытается заманить жителей в квартиры —;В Улан-Баторе до сих пор есть целый район с юртами.;elaboration_r
монголы держатся за свои юрты до последнего!;И как правительство не пытается заманить жителей в квартиры —;contrast_m
В отличие от той же Бурятии,;И как правительство не пытается заманить жителей в квартиры —;elaboration_r
где в юртах уже практически не живут, даже в деревнях,;В отличие от той же Бурятии,;elaboration_r
в Монголии и в деревнях живут, и в городах.;В отличие от той же Бурятии,;comparison_m
Монголия — это островок доподлинной аутентичности.;В Улан-Баторе до сих пор есть целый район с юртами.;evaluation_r
Это приятно,;Монголия — это островок доподлинной аутентичности.;evaluation_r
интересно.;Это приятно,;joint_m
Вернемся к казахам-кочевникам.;Зашли мы в юрту,;preparation_r
сели на кровать,;Зашли мы в юрту,;sequence_m
ждем угощения.;Зашли мы в юрту,;sequence_m
В юрте живет, вроде как, трое взрослых и двое детей.;Зашли мы в юрту,;elaboration_r
Скажу сразу — по достижении школьного возраста кочевники отдают детей в школы.;В юрте живет, вроде как, трое взрослых и двое детей.;elaboration_r
Детей монголы очень любят.;Скажу сразу — по достижении школьного возраста кочевники отдают детей в школы.;elaboration_r
Стараются дать получше образование, возможность изучать языки,;Детей монголы очень любят.;evidence_r
балуют подарками.;Стараются дать получше образование, возможность изучать языки,;joint_m
Обстановка в юрте такая:;В юрте живет, вроде как, трое взрослых и двое детей.;joint_m
посередине стоит печка;Обстановка в юрте такая:;elaboration_r
для варки еды,;посередине стоит печка;purpose_r
труба выходит на улицу, 2 кровати, полочки, табуреточки, посуда,;посередине стоит печка;joint_m
также стоит чан с кумысом;посередине стоит печка;joint_m
(кисломолочный напиток из кобыльего молока, настаивается несколько дней).;также стоит чан с кумысом;elaboration_r
За кумысом мы и зашли.;также стоит чан с кумысом;purpose_r
Кочевники живут, кроме прочего, на доходы от продажи кумыса.;Ну что, попробовали —;background_r
Ну что, попробовали —;За кумысом мы и зашли.;elaboration_r
кумыс прикольный,;Ну что, попробовали —;evaluation_r
кисленький,;кумыс прикольный,;joint_m
жидкий,;кумыс прикольный,;joint_m
похож отдаленно на кефир обезжиренный.;кумыс прикольный,;comparison_m
Оставили за гостеприимство и кумыс денежку,;Ну что, попробовали —;joint_m
но это не обязательно.;Оставили за гостеприимство и кумыс денежку,;contrast_m
Каждый кочевник примет путника,;но это не обязательно.;evidence_r
накормит;Каждый кочевник примет путника,;joint_m
и обогреет совершенно бесплатно.;Каждый кочевник примет путника,;joint_m
Монголия — край суровый, особенного зимой.;Каждый кочевник примет путника,;cause_r
Чан с кумысом.  Жилая юрта.  Кумыс.  Традиционное занятие монголов - скотоводство.   Двугорбый верблюд мало где обитает на Земле. Монголия - одно из таких мест.;Зашли мы в юрту,;elaboration_r
Уж слишком далеко она от Улан-Батора,;К большому сожалению, не удалось увидеть пустыню Гоби.;cause_r
и слишком мало времени было.;Уж слишком далеко она от Улан-Батора,;joint_m
Но ради неё, в том числе, я вернусь в Монголию ещё раз.;Уж слишком далеко она от Улан-Батора,;contrast_m
Однако могу сказать,;что такси относительно не дорогое,;attribution_r
что такси относительно не дорогое,;Передвигались мы везде на заранее заказанном авто.;contrast_m
но опять же, многие таксисты говорят только на монгольском.;что такси относительно не дорогое,;contrast_m
Есть междугородний транспорт, автовокзал.;Передвигались мы везде на заранее заказанном авто.;elaboration_r
Ехать в Монголию, всё же, лучше в теплое время года.;Передвигались мы везде на заранее заказанном авто.;joint_m
Монгол Шуудан переводится как Монгольская почта.;Передвигались мы везде на заранее заказанном авто.;joint_m
но как-то на жизнь не жалуются.;Монголы живут не богато,;contrast_m
Может, потому что буддисты).;Монголы живут не богато,;evaluation_r
Отдельно нужно сказать о кухне Монголии.;Кухня — это сплошные блюда из мяса — буузы, хушуры, цуйван.;preparation_r
Кухня — это сплошные блюда из мяса — буузы, хушуры, цуйван.;Монголы живут не богато,;joint_m
В общем, для меня, как человека,;Кухня — это сплошные блюда из мяса — буузы, хушуры, цуйван.;elaboration_r
который уже 2 года не ест мясо;В общем, для меня, как человека,;cause_r
и не собирается —;который уже 2 года не ест мясо;joint_m
нужно было потрудиться,;В общем, для меня, как человека,;same-unit_m
чтобы выбрать что-то национальное и не мясное.;В общем, для меня, как человека,;purpose_r
Но меня не проведешь —;В общем, для меня, как человека,;contrast_m
я и буузы нашла с овощами, и цуйван с морепродуктами.;Но меня не проведешь —;cause_r
Да — все ржали)) но всё же!;Но меня не проведешь —;evaluation_r
Национальные блюда схожи с бурятскими.;Кухня — это сплошные блюда из мяса — буузы, хушуры, цуйван.;comparison_m
Буряты и монголы вообще как единый народ.;Национальные блюда схожи с бурятскими.;evaluation_r
В 20 — 30-е годы 20 века было даже национальное движение за объединение Монголии и Бурятии.;Национальные блюда схожи с бурятскими.;background_r
Из напитков меня покорил монгольских чай.;Кухня — это сплошные блюда из мяса — буузы, хушуры, цуйван.;joint_m
Чаем это, конечно, уже сложно назвать.;Из напитков меня покорил монгольских чай.;evaluation_r
Мешанина жуткая.;Чаем это, конечно, уже сложно назвать.;cause_r
Это одновременно и суп, и второе блюдо, и десерт,;Мешанина жуткая.;evidence_r
но вкусно,;Это одновременно и суп, и второе блюдо, и десерт,;contrast_m
согревает;но вкусно,;joint_m
и как-то успокаивает.;но вкусно,;joint_m
Мне настолько понравился,;что хапнула потом в магазине огромный пакет этого чая.;cause_r
что хапнула потом в магазине огромный пакет этого чая.;Из напитков меня покорил монгольских чай.;evaluation_r
Теперь,;что хапнула потом в магазине огромный пакет этого чая.;elaboration_r
когда навожу;вспоминаю радушную Монголию.;cause_r
и пью его —;когда навожу;joint_m
вспоминаю радушную Монголию.;Теперь,;same-unit_m
Состав примерно такой — настой трав (или китайский зеленый чай), крупа, соль, молоко, масло сливочное.;Из напитков меня покорил монгольских чай.;elaboration_r
Можно и буузы туда кинуть, не шутка);Состав примерно такой — настой трав (или китайский зеленый чай), крупа, соль, молоко, масло сливочное.;elaboration_r
Ну а что — быстро;Можно и буузы туда кинуть, не шутка);evaluation_r
и питательно.;Ну а что — быстро;joint_m
Овощные буузы.  Знаменитый чай!;Кухня — это сплошные блюда из мяса — буузы, хушуры, цуйван.;elaboration_r
Путешествие заканчивается, пора домой, через Улан-Удэ.;Болор отлично говорит по-русски,;preparation_r
но ни разу не была в России.;Болор отлично говорит по-русски,;contrast_m
Мечтает поехать в Москву, причем в Москву и только в Москву);Болор отлично говорит по-русски,;joint_m
Болор, желаю тебе скорее осуществить эту мечту!);Болор отлично говорит по-русски,;joint_m
А частичку моей души Монголия забрала навсегда, определённо..;Болор отлично говорит по-русски,;joint_m