level_0	index	EDU_1	EDU_2	Relation	num_of_words_1	avg_word_len_1	upcase_words_num_1	num_unique_words_1	count_words_title_1	mean_word_len_1	words_vs_unique_1	num_of_words_2	avg_word_len_2	upcase_words_num_2	num_unique_words_2	count_words_title_2	mean_word_len_2	words_vs_unique_2	bleu_score	nouns_count_1	verbs_count_1	adj_count_1	adv_count_1	aux_count_1	num_count_1	vbd_count_1	nouns_vs_words_1	adjectives_vs_words_1	verbs_vs_words_1	adp_count_1	cconj_count_1	sconj_count_1	part_count_1	pron_count_1	nouns_count_2	verbs_count_2	adj_count_2	adv_count_2	aux_count_2	num_count_2	vbd_count_2	nouns_vs_words_2	adjectives_vs_words_2	verbs_vs_words_2	adp_count_2	cconj_count_2	sconj_count_2	part_count_2	pron_count_2
5297	5309	и, главное, осмелился их пробовать?	Кто собирал такие грибы	joint_m	5	6.2	0	5	0	6.2	1.0	4	5.0	1	4	1	5.0	1.0	0.5102371984579963	1	2	0	0	0	0	0	0.2	0.0	0.4	0	1	0	0	1	1	1	0	0	0	0	0	0.25	0.0	0.25	0	0	0	0	1
5298	5310	Поделитесь опытом, грибоеды!	И пылили спорами,	joint_m	3	8.666666666666666	1	3	1	8.666666666666666	1.0	3	5.0	1	3	1	5.0	1.0	0.43989809962024357	2	1	0	0	0	0	0	0.6666666666666666	0.0	0.3333333333333333	0	0	0	0	0	1	1	0	0	0	0	0	0.3333333333333333	0.0	0.3333333333333333	0	1	0	0	0
5299	5311	Меня зовут Дарья,	В этом вступительном посте хочу рассказать о своих волосах, об их изменениях за последние полгода, о методах окрашивания, об уходе за ними.	preparation_r	3	5.0	2	3	2	5.0	1.0	22	5.363636363636363	1	19	1	5.363636363636363	0.8636363636363636	0.3285021599088021	0	1	0	0	0	0	0	0.0	0.0	0.3333333333333333	0	0	0	0	1	7	2	2	0	0	0	0	0.3181818181818182	0.09090909090909091	0.09090909090909091	7	0	0	0	1
5300	5312	и я новенький автор,	Меня зовут Дарья,	joint_m	4	4.25	0	4	0	4.25	1.0	3	5.0	2	3	2	5.0	1.0	0.704248547032515	1	0	1	0	0	0	0	0.25	0.25	0.0	0	1	0	0	1	0	1	0	0	0	0	0	0.0	0.0	0.3333333333333333	0	0	0	0	1
5301	5313	банально, не находите?)	Меня зовут Дарья,	evaluation_r	3	7.0	0	3	0	7.0	1.0	3	5.0	2	3	2	5.0	1.0	0.5112300676685234	0	1	0	1	0	0	0	0.0	0.0	0.3333333333333333	0	0	0	1	0	0	1	0	0	0	0	0	0.0	0.0	0.3333333333333333	0	0	0	0	1
5302	5314	и я люблю ухаживать за волосами.	Меня зовут Дарья,	joint_m	6	4.5	0	6	0	4.5	1.0	3	5.0	2	3	2	5.0	1.0	0.3173763241705232	1	2	0	0	0	0	0	0.16666666666666666	0.0	0.3333333333333333	1	1	0	0	1	0	1	0	0	0	0	0	0.0	0.0	0.3333333333333333	0	0	0	0	1
5303	5315	А так же красить их, будь-то травами(хна и басма) или же перманентным красителем\прямым пигментом.	Меня зовут Дарья,	joint_m	14	6.071428571428571	1	13	1	6.071428571428571	0.9285714285714286	3	5.0	2	3	2	5.0	1.0	0.007455241956809824	4	1	2	1	0	0	0	0.2857142857142857	0.14285714285714285	0.07142857142857142	0	3	0	3	1	0	1	0	0	0	0	0	0.0	0.0	0.3333333333333333	0	0	0	0	1
5304	5316	А так же пройдусь по актуальному уходу.	В этом вступительном посте хочу рассказать о своих волосах, об их изменениях за последние полгода, о методах окрашивания, об уходе за ними.	joint_m	7	4.714285714285714	1	7	1	4.714285714285714	1.0	22	5.363636363636363	1	19	1	5.363636363636363	0.8636363636363636	0.4945748846704234	1	1	1	1	0	0	0	0.14285714285714285	0.14285714285714285	0.14285714285714285	1	1	0	1	0	7	2	2	0	0	0	0	0.3181818181818182	0.09090909090909091	0.09090909090909091	7	0	0	0	1
5305	5317	Времена хны и басмы	Я обладательница негустых, средне-русых волос.	preparation_r	4	4.0	1	4	1	4.0	1.0	5	8.4	1	5	1	8.4	1.0	0.5897678246195885	3	0	0	0	0	0	0	0.75	0.0	0.0	0	1	0	0	0	2	0	2	0	0	0	0	0.4	0.4	0.0	0	0	0	0	1
5306	5318	Я обладательница негустых, средне-русых волос.	Около трех лет я красилась хной и басмой раздельным способом.	background_r	5	8.4	1	5	1	8.4	1.0	10	5.2	1	10	1	5.2	1.0	0.7465768876548	2	0	2	0	0	0	0	0.4	0.4	0.0	0	0	0	0	1	4	1	1	0	0	1	0	0.4	0.1	0.1	1	1	0	0	1
5307	5319	Если выражаться парикмахерским языком,	то 6-7 угт.	condition_r	4	8.75	1	4	1	8.75	1.0	3	3.0	0	3	0	3.0	1.0	0.05180099557096494	1	1	1	0	0	0	0	0.25	0.25	0.25	0	0	1	0	0	1	0	0	0	0	1	0	0.3333333333333333	0.0	0.0	0	0	1	0	0
5308	5320	то 6-7 угт.	Я обладательница негустых, средне-русых волос.	elaboration_r	3	3.0	0	3	0	3.0	1.0	5	8.4	1	5	1	8.4	1.0	0.4423258684646914	1	0	0	0	0	1	0	0.3333333333333333	0.0	0.0	0	0	1	0	0	2	0	2	0	0	0	0	0.4	0.4	0.0	0	0	0	0	1
5309	5321	То есть слишком темный оттенок,	то 6-7 угт.	restatement_m	5	5.4	1	5	1	5.4	1.0	3	3.0	0	3	0	3.0	1.0	0.10943653373375141	1	1	1	1	0	0	0	0.2	0.2	0.2	0	0	0	0	1	1	0	0	0	0	1	0	0.3333333333333333	0.0	0.0	0	0	1	0	0
5310	5322	чтобы поиграть на них яркими цветами без осветления\обесцвечивания	То есть слишком темный оттенок,	purpose_r	8	7.375	0	8	0	7.375	1.0	5	5.4	1	5	1	5.4	1.0	0.2961238229667146	2	1	1	0	0	0	0	0.25	0.125	0.125	2	0	1	0	1	1	1	1	1	0	0	0	0.2	0.2	0.2	0	0	0	0	1
5311	5323	или же получить ярко-медный от хны без тех же манипуляций.	чтобы поиграть на них яркими цветами без осветления\обесцвечивания	joint_m	10	4.9	0	9	0	4.9	0.9	8	7.375	0	8	0	7.375	1.0	0.7977240352174656	2	1	1	0	0	0	0	0.2	0.1	0.1	2	1	0	2	0	2	1	1	0	0	0	0	0.25	0.125	0.125	2	0	1	0	1
5312	5324	Такой метод,	Около трех лет я красилась хной и басмой раздельным способом.	elaboration_r	2	5.5	1	2	1	5.5	1.0	10	5.2	1	10	1	5.2	1.0	0.40488816508945796	1	0	0	0	0	0	0	0.5	0.0	0.0	0	0	0	0	0	4	1	1	0	0	1	0	0.4	0.1	0.1	1	1	0	0	1
5313	5325	где ты сначала красишь волосы хной,	Такой метод,	elaboration_r	6	5.0	0	6	0	5.0	1.0	2	5.5	1	2	1	5.5	1.0	0.1342800888674276	2	1	0	2	0	0	0	0.3333333333333333	0.0	0.16666666666666666	0	0	0	0	1	1	0	0	0	0	0	0	0.5	0.0	0.0	0	0	0	0	0
5314	5326	потом смываешь,	где ты сначала красишь волосы хной,	sequence_m	2	7.0	0	2	0	7.0	1.0	6	5.0	0	6	0	5.0	1.0	0.5855400437691199	0	1	0	1	0	0	0	0.0	0.0	0.5	0	0	0	0	0	2	1	0	2	0	0	0	0.3333333333333333	0.0	0.16666666666666666	0	0	0	0	1
5315	5327	подсушиваешь	где ты сначала красишь волосы хной,	sequence_m	1	12.0	0	1	0	12.0	1.0	6	5.0	0	6	0	5.0	1.0	0.50709255283711	0	1	0	0	0	0	0	0.0	0.0	1.0	0	0	0	0	0	2	1	0	2	0	0	0	0.3333333333333333	0.0	0.16666666666666666	0	0	0	0	1
5316	5328	и красишь поверх этого басмой,	где ты сначала красишь волосы хной,	sequence_m	5	5.2	0	5	0	5.2	1.0	6	5.0	0	6	0	5.0	1.0	0.8106434833777776	1	1	0	0	0	0	0	0.2	0.0	0.2	1	1	0	0	1	2	1	0	2	0	0	0	0.3333333333333333	0.0	0.16666666666666666	0	0	0	0	1
5317	5329	дает возможность со временем, а иногда и сразу получить красивый черный цвет волос.	Такой метод,	same-unit_m	13	5.461538461538462	0	13	0	5.461538461538462	1.0	2	5.5	1	2	1	5.5	1.0	0.0025794673492002523	4	2	2	2	0	0	0	0.3076923076923077	0.15384615384615385	0.15384615384615385	1	1	0	1	0	1	0	0	0	0	0	0	0.5	0.0	0.0	0	0	0	0	0
5318	5330	Почему я пользовалась травяными красителями?	Мне нравился аромат хны	solutionhood_r	5	8.0	1	5	1	8.0	1.0	4	5.0	1	4	1	5.0	1.0	0.3647397852963096	1	1	1	1	0	0	0	0.2	0.2	0.2	0	0	0	0	1	2	1	0	0	0	0	0	0.5	0.0	0.25	0	0	0	0	1
5319	5331	Мне нравился аромат хны	Около трех лет я красилась хной и басмой раздельным способом.	joint_m	4	5.0	1	4	1	5.0	1.0	10	5.2	1	10	1	5.2	1.0	0.5725983343138682	2	1	0	0	0	0	0	0.5	0.0	0.25	0	0	0	0	1	4	1	1	0	0	1	0	0.4	0.1	0.1	1	1	0	0	1
5320	5332	и совершенно не нравился запах басмы,	Мне нравился аромат хны	contrast_m	6	5.333333333333333	0	6	0	5.333333333333333	1.0	4	5.0	1	4	1	5.0	1.0	0.5198673785024	2	1	0	1	0	0	0	0.3333333333333333	0.0	0.16666666666666666	0	1	0	1	0	2	1	0	0	0	0	0	0.5	0.0	0.25	0	0	0	0	1
5321	5333	но я обожаю черный цвет.	Мне нравился аромат хны	contrast_m	5	4.0	0	5	0	4.0	1.0	4	5.0	1	4	1	5.0	1.0	0.7198224532399072	1	1	1	0	0	0	0	0.2	0.2	0.2	0	1	0	0	1	2	1	0	0	0	0	0	0.5	0.0	0.25	0	0	0	0	1
5322	5334	Черный цвет на века,	Мне нравился аромат хны	evaluation_r	4	4.25	1	4	1	4.25	1.0	4	5.0	1	4	1	5.0	1.0	0.7223151185146152	2	0	1	0	0	0	0	0.5	0.25	0.0	1	0	0	0	0	2	1	0	0	0	0	0	0.5	0.0	0.25	0	0	0	0	1
5323	5335	который будет с тобой до конца твоих дней	Черный цвет на века,	elaboration_r	8	4.25	0	8	0	4.25	1.0	4	4.25	1	4	1	4.25	1.0	0.303054980473406	2	0	0	0	1	0	0	0.25	0.0	0.0	2	0	0	0	2	2	0	1	0	0	0	0	0.5	0.25	0.0	1	0	0	0	0
5324	5336	или пока ты не срежешь его))	который будет с тобой до конца твоих дней	joint_m	6	3.8333333333333335	0	6	0	3.8333333333333335	1.0	8	4.25	0	8	0	4.25	1.0	0.6439209162167846	0	1	0	0	0	0	0	0.0	0.0	0.16666666666666666	0	1	1	1	2	2	0	0	0	1	0	0	0.25	0.0	0.0	2	0	0	0	2
5325	5337	точнее любила,	Хну люблю ,	elaboration_r	2	6.5	0	2	0	6.5	1.0	3	3.0	1	3	1	3.0	1.0	0.6073076164884471	0	1	0	1	0	0	0	0.0	0.0	0.5	0	0	0	0	0	0	1	0	0	0	0	0	0.0	0.0	0.3333333333333333	0	0	0	0	0
5326	5338	потому что сейчас я не на травяных красителях,	точнее любила,	cause_r	8	4.875	0	8	0	4.875	1.0	2	6.5	0	2	0	6.5	1.0	0.09014864913131009	1	0	1	2	0	0	0	0.125	0.125	0.0	1	0	1	1	1	0	1	0	1	0	0	0	0.0	0.0	0.5	0	0	0	0	0
5327	5339	качественную, с мельчайшим помолом и интенсивным выделением пигмента.	Хну люблю ,	same-unit_m	8	7.75	0	8	0	7.75	1.0	3	3.0	1	3	1	3.0	1.0	0.004374538990667139	3	0	3	0	0	0	0	0.375	0.375	0.0	1	1	0	0	0	0	1	0	0	0	0	0	0.0	0.0	0.3333333333333333	0	0	0	0	0
5328	5340	Как правило, это либо хна для мехенди,	Хну люблю ,	elaboration_r	7	4.571428571428571	1	7	1	4.571428571428571	1.0	3	3.0	1	3	1	3.0	1.0	0.06852627597316577	3	0	0	0	0	0	0	0.42857142857142855	0.0	0.0	1	1	1	0	1	0	1	0	0	0	0	0	0.0	0.0	0.3333333333333333	0	0	0	0	0
5329	5341	которая максимальна в вышеперечисленных свойствах,	Как правило, это либо хна для мехенди,	elaboration_r	5	9.2	0	5	0	9.2	1.0	7	4.571428571428571	1	7	1	4.571428571428571	1.0	0.625952807277286	1	0	2	0	0	0	0	0.2	0.4	0.0	1	0	0	0	1	3	0	0	0	0	0	0	0.42857142857142855	0.0	0.0	1	1	1	0	1
5330	5342	либо хна,	Как правило, это либо хна для мехенди,	same-unit_m	2	4.0	0	2	0	4.0	1.0	7	4.571428571428571	1	7	1	4.571428571428571	1.0	0.4866642633922876	1	0	0	0	0	0	0	0.5	0.0	0.0	0	1	0	0	0	3	0	0	0	0	0	0	0.42857142857142855	0.0	0.0	1	1	1	0	1
5331	5343	которую можно найти в аюрведических салонах и таких же интернет-магазинах.	либо хна,	elaboration_r	10	6.5	0	10	0	6.5	1.0	2	4.0	0	2	0	4.0	1.0	0.000643956464171852	2	1	1	1	0	0	0	0.2	0.1	0.1	1	1	0	1	1	1	0	0	0	0	0	0	0.5	0.0	0.0	0	1	0	0	0
5332	5344	Что до басмы, здесь те же критерии.	Хну люблю ,	comparison_m	7	4.142857142857143	1	7	1	4.142857142857143	1.0	3	3.0	1	3	1	3.0	1.0	0.06804278110998846	2	0	0	1	0	0	0	0.2857142857142857	0.0	0.0	1	0	0	1	1	0	1	0	0	0	0	0	0.0	0.0	0.3333333333333333	0	0	0	0	0
5333	5345	На фото хна брендов: Lady Henna, INDI BIRD, Nupur, Aroma-Zone, Hathi, Prem Dulhan, Kokila, период использования 2017-2018 года, на данный момент у меня нет этих средств в обиходе. Басма брендов: Kajal, Khadi, INDI BIRD, период использования те же 2017-2018 года, сейчас не использую.	Хну люблю ,	elaboration_r	43	5.604651162790698	12	36	12	5.604651162790698	0.8372093023255814	3	3.0	1	3	1	3.0	1.0	1.6500868913178773e-11	13	2	1	1	0	2	0	0.3023255813953488	0.023255813953488372	0.046511627906976744	4	0	0	2	1	0	1	0	0	0	0	0	0.0	0.0	0.3333333333333333	0	0	0	0	0
5334	5346	и превращают в веник.	Многие думают, что хна, басма и прочие травы сушат волосы	joint_m	4	4.5	0	4	0	4.5	1.0	10	4.8	1	10	1	4.8	1.0	0.5461186812727502	1	1	0	0	0	0	0	0.25	0.0	0.25	1	1	0	0	0	4	2	1	0	0	1	0	0.4	0.1	0.2	0	1	1	0	0
5335	5347	С таким же успехом можно говорить о том, что обесцвечивание портит волосы	Многие думают, что хна, басма и прочие травы сушат волосы	comparison_m	12	5.166666666666667	1	12	1	5.166666666666667	1.0	10	4.8	1	10	1	4.8	1.0	0.6784756488335099	3	2	0	1	0	0	0	0.25	0.0	0.16666666666666666	2	0	1	1	1	4	2	1	0	0	1	0	0.4	0.1	0.2	0	1	1	0	0
5336	5348	и превращает в тот же веник, только другого цвета))	С таким же успехом можно говорить о том, что обесцвечивание портит волосы	joint_m	9	4.777777777777778	0	9	0	4.777777777777778	1.0	12	5.166666666666667	1	12	1	5.166666666666667	1.0	0.7674901275524076	2	1	1	0	0	0	0	0.2222222222222222	0.1111111111111111	0.1111111111111111	1	1	0	2	0	3	2	0	1	0	0	0	0.25	0.0	0.16666666666666666	2	0	1	1	1
5337	5349	Да, конечно, если вы не ухаживаете за волосами,	то даже натуральные волосы превратятся в невообразимое нечто,	condition_r	8	5.0	1	8	1	5.0	1.0	8	6.75	0	8	0	6.75	1.0	0.8097763301789159	1	1	0	1	0	0	0	0.125	0.0	0.125	1	0	1	2	1	1	1	2	0	0	0	0	0.125	0.25	0.125	1	0	1	1	1
5338	5350	то даже натуральные волосы превратятся в невообразимое нечто,	Многие думают, что хна, басма и прочие травы сушат волосы	elaboration_r	8	6.75	0	8	0	6.75	1.0	10	4.8	1	10	1	4.8	1.0	0.800221861111986	1	1	2	0	0	0	0	0.125	0.25	0.125	1	0	1	1	1	4	2	1	0	0	1	0	0.4	0.1	0.2	0	1	1	0	0
5339	5351	которое можно только срезать	то даже натуральные волосы превратятся в невообразимое нечто,	elaboration_r	4	6.25	0	4	0	6.25	1.0	8	6.75	0	8	0	6.75	1.0	0.6401843996644799	0	1	0	1	0	0	0	0.0	0.0	0.25	0	0	0	1	1	1	1	2	0	0	0	0	0.125	0.25	0.125	1	0	1	1	1
5340	5352	или закератинить,	которое можно только срезать	joint_m	2	8.0	0	2	0	8.0	1.0	4	6.25	0	4	0	6.25	1.0	0.6267831705280087	0	1	0	0	0	0	0	0.0	0.0	0.5	0	1	0	0	0	0	1	0	1	0	0	0	0.0	0.0	0.25	0	0	0	1	1
5341	5353	а потом… тоже срезать.	которое можно только срезать	joint_m	4	4.75	0	4	0	4.75	1.0	4	6.25	0	4	0	6.25	1.0	0.8017837257372732	0	1	0	0	0	0	0	0.0	0.0	0.25	0	1	0	1	0	0	1	0	1	0	0	0	0.0	0.0	0.25	0	0	0	1	1
5342	5354	За любыми волосами нужен уход.	Многие думают, что хна, басма и прочие травы сушат волосы	evaluation_r	5	5.2	1	5	1	5.2	1.0	10	4.8	1	10	1	4.8	1.0	0.6753816335059705	2	0	1	0	0	0	0	0.4	0.2	0.0	1	0	0	0	0	4	2	1	0	0	1	0	0.4	0.1	0.2	0	1	1	0	0
5343	5355	Кому-то достаточно шампуня, кондиционера и одной несмывашки+масочка на длину 1 раз в неделю,	За любыми волосами нужен уход.	elaboration_r	13	6.153846153846154	0	13	0	6.153846153846154	1.0	5	5.2	1	5	1	5.2	1.0	0.1155759435632605	6	0	0	1	0	2	0	0.46153846153846156	0.0	0.0	2	1	0	0	1	2	0	1	0	0	0	0	0.4	0.2	0.0	1	0	0	0	0
5344	5356	а у кого-то шампунь+маска+кондей после маски+трехступенчатый несмываемый уход и обязательная укладка феном,	Кому-то достаточно шампуня, кондиционера и одной несмывашки+масочка на длину 1 раз в неделю,	comparison_m	12	8.0	0	12	0	8.0	1.0	13	6.153846153846154	0	13	0	6.153846153846154	1.0	0.7515596432942665	4	0	3	0	0	0	0	0.3333333333333333	0.25	0.0	2	2	0	0	1	6	0	0	1	0	2	0	0.46153846153846156	0.0	0.0	2	1	0	0	1
5345	5357	иначе волосы будут выглядеть совсем не должным образом.	а у кого-то шампунь+маска+кондей после маски+трехступенчатый несмываемый уход и обязательная укладка феном,	cause_r	8	6.0	0	8	0	6.0	1.0	12	8.0	0	12	0	8.0	1.0	0.6835859270246633	2	1	1	1	1	0	0	0.25	0.125	0.125	0	1	0	1	0	4	0	3	0	0	0	0	0.3333333333333333	0.25	0.0	2	2	0	0	1
5346	5358	Я, если можно так выразиться, адепт профессионального ухода за волосами.	В период окрашивания травами у меня был облегченный, но увлажняющий уход.	preparation_r	10	6.3	1	10	1	6.3	1.0	11	5.7272727272727275	1	11	1	5.7272727272727275	1.0	0.835840975895715	3	1	1	2	0	0	0	0.3	0.1	0.1	1	0	1	0	1	4	3	0	0	0	0	0	0.36363636363636365	0.0	0.2727272727272727	2	1	0	0	1
5347	5359	Волосы натуральные,	В период окрашивания травами у меня был облегченный, но увлажняющий уход.	elaboration_r	2	9.0	1	2	1	9.0	1.0	11	5.7272727272727275	1	11	1	5.7272727272727275	1.0	0.4825730124331106	1	0	1	0	0	0	0	0.5	0.5	0.0	0	0	0	0	0	4	3	0	0	0	0	0	0.36363636363636365	0.0	0.2727272727272727	2	1	0	0	1
5348	5360	сверху покрыты травяными пигментами,	Волосы натуральные,	joint_m	4	8.25	0	4	0	8.25	1.0	2	9.0	1	2	1	9.0	1.0	0.3508390643173187	1	1	1	1	0	0	0	0.25	0.25	0.25	0	0	0	0	0	1	0	1	0	0	0	0	0.5	0.5	0.0	0	0	0	0	0
5349	5361	не нуждаются в таких компонентах, которые как воздух необходимы волосам, подверженным химическому окрашиванию.	Волосы натуральные,	joint_m	13	7.538461538461538	0	13	0	7.538461538461538	1.0	2	9.0	1	2	1	9.0	1.0	0.007632049853625466	4	1	3	0	0	0	0	0.3076923076923077	0.23076923076923078	0.07692307692307693	1	0	1	1	1	1	0	1	0	0	0	0	0.5	0.5	0.0	0	0	0	0	0
5350	5362	Костяк моего тогдашнего ухода: шампунь, маска, масляная несмывашка.	В период окрашивания травами у меня был облегченный, но увлажняющий уход.	elaboration_r	8	7.5	1	8	1	7.5	1.0	11	5.7272727272727275	1	11	1	5.7272727272727275	1.0	0.7763631405646441	5	0	2	0	0	0	0	0.625	0.25	0.0	0	0	0	0	0	4	3	0	0	0	0	0	0.36363636363636365	0.0	0.2727272727272727	2	1	0	0	1
5351	5363	Сушка феном,	Костяк моего тогдашнего ухода: шампунь, маска, масляная несмывашка.	joint_m	2	5.5	1	2	1	5.5	1.0	8	7.5	1	8	1	7.5	1.0	0.3863337046431279	2	0	0	0	0	0	0	1.0	0.0	0.0	0	0	0	0	0	5	0	2	0	0	0	0	0.625	0.25	0.0	0	0	0	0	0
5352	5364	поскольку я не любитель влажных от волос маек и тяжелых тюрбанов из мокрого полотенца.	Сушка феном,	cause_r	14	5.214285714285714	0	14	0	5.214285714285714	1.0	2	5.5	1	2	1	5.5	1.0	0.001713188164402639	5	0	3	0	0	0	0	0.35714285714285715	0.21428571428571427	0.0	2	1	1	1	1	2	0	0	0	0	0	0	1.0	0.0	0.0	0	0	0	0	0
5353	5365	На фото средства времен лета 2018г: питательная маска с маслом монои Kaaral Maraes, увлажняющая маска с алоэ-вера Kaaral Hydra, еще одна маска с алоэ Ollin Full Forse, масло Kerastase Elixir Ultime для окрашенных волос, восстанавливающий шампунь Kaaral Purify Reale. Сейчас у меня осталась только маска Kaaral Maraes, это литр просто нескончаем.	В период окрашивания травами у меня был облегченный, но увлажняющий уход.	elaboration_r	51	5.784313725490196	17	42	17	5.784313725490196	0.8235294117647058	11	5.7272727272727275	1	11	1	5.7272727272727275	1.0	0.023419087932341154	17	4	2	2	0	1	0	0.3333333333333333	0.0392156862745098	0.0784313725490196	6	0	0	2	2	4	3	0	0	0	0	0	0.36363636363636365	0.0	0.2727272727272727	2	1	0	0	1
5354	5366	В августе 2018 года я захотела перемен в длине волос и в цвете.	Я отрезала волосы по плечи	preparation_r	13	3.923076923076923	1	12	1	3.923076923076923	0.9230769230769231	5	4.4	1	5	1	4.4	1.0	0.22166147121242505	6	1	0	0	0	1	0	0.46153846153846156	0.0	0.07692307692307693	3	1	0	0	1	2	1	0	0	0	0	0	0.4	0.0	0.2	1	0	0	0	1
5355	5367	и убрала из окрашивания басму, оставив хну.	Я отрезала волосы по плечи	joint_m	7	5.285714285714286	0	7	0	5.285714285714286	1.0	5	4.4	1	5	1	4.4	1.0	0.39500007575122126	3	2	0	0	0	0	0	0.42857142857142855	0.0	0.2857142857142857	1	1	0	0	0	2	1	0	0	0	0	0	0.4	0.0	0.2	1	0	0	0	1
5356	5368	Хотелось стать чуть посветлее, ярче, теплее, солнечнее.	Я отрезала волосы по плечи	cause_r	7	7.0	1	7	1	7.0	1.0	5	4.4	1	5	1	4.4	1.0	0.2945897214144348	0	2	4	1	0	0	0	0.0	0.5714285714285714	0.2857142857142857	0	0	0	0	0	2	1	0	0	0	0	0	0.4	0.0	0.2	1	0	0	0	1
5357	5369	Но какой бы шикарной не была хна,	она не сделает имеющиеся волосы светлее.	concession_r	7	3.857142857142857	1	7	1	3.857142857142857	1.0	6	5.833333333333333	0	6	0	5.833333333333333	1.0	0.6324555320336759	0	0	2	0	1	0	0	0.0	0.2857142857142857	0.0	0	1	0	2	0	1	2	1	0	0	0	0	0.16666666666666666	0.16666666666666666	0.3333333333333333	0	0	0	1	1
5358	5370	она не сделает имеющиеся волосы светлее.	Я отрезала волосы по плечи	elaboration_r	6	5.833333333333333	0	6	0	5.833333333333333	1.0	5	4.4	1	5	1	4.4	1.0	0.49892957877499267	1	2	1	0	0	0	0	0.16666666666666666	0.16666666666666666	0.3333333333333333	0	0	0	1	1	2	1	0	0	0	0	0	0.4	0.0	0.2	1	0	0	0	1
5359	5371	Она лишь придаст им медный оттенок	она не сделает имеющиеся волосы светлее.	contrast_m	6	4.833333333333333	1	6	1	4.833333333333333	1.0	6	5.833333333333333	0	6	0	5.833333333333333	1.0	0.7416198487095663	1	1	1	0	0	0	0	0.16666666666666666	0.16666666666666666	0.16666666666666666	0	0	0	1	2	1	2	1	0	0	0	0	0.16666666666666666	0.16666666666666666	0.3333333333333333	0	0	0	1	1
5360	5372	и слегка затемнит.	Она лишь придаст им медный оттенок	joint_m	3	5.333333333333333	0	3	0	5.333333333333333	1.0	6	4.833333333333333	1	6	1	4.833333333333333	1.0	0.6642111641550714	0	1	0	1	0	0	0	0.0	0.0	0.3333333333333333	0	1	0	0	0	1	1	1	0	0	0	0	0.16666666666666666	0.16666666666666666	0.16666666666666666	0	0	0	1	2
5361	5373	Относительно небольшая длина,	Теперь волосы требовали еще меньше ухода с моей стороны.	elaboration_r	3	9.0	1	3	1	9.0	1.0	9	5.333333333333333	1	9	1	5.333333333333333	1.0	0.6267831705280087	1	0	1	1	0	0	0	0.3333333333333333	0.3333333333333333	0.0	0	0	0	0	0	3	1	0	2	0	1	0	0.3333333333333333	0.0	0.1111111111111111	1	0	0	0	0
5362	5374	густой обновленный срез.	Относительно небольшая длина,	joint_m	3	7.333333333333333	0	3	0	7.333333333333333	1.0	3	9.0	1	3	1	9.0	1.0	0.6948083337796512	1	0	2	0	0	0	0	0.3333333333333333	0.6666666666666666	0.0	0	0	0	0	0	1	0	1	1	0	0	0	0.3333333333333333	0.3333333333333333	0.0	0	0	0	0	0
5363	5375	Красота.	Теперь волосы требовали еще меньше ухода с моей стороны.	evaluation_r	1	8.0	1	1	1	8.0	1.0	9	5.333333333333333	1	9	1	5.333333333333333	1.0	0.3535533905932738	1	0	0	0	0	0	0	1.0	0.0	0.0	0	0	0	0	0	3	1	0	2	0	1	0	0.3333333333333333	0.0	0.1111111111111111	1	0	0	0	0
5364	5376	Отращивай	Красота.	elaboration_r	1	9.0	1	1	1	9.0	1.0	1	8.0	1	1	1	8.0	1.0	0.6240195441936915	0	1	0	0	0	0	0	0.0	0.0	1.0	0	0	0	0	0	1	0	0	0	0	0	0	1.0	0.0	0.0	0	0	0	0	0
5365	5377	и не мучайся!	Отращивай	joint_m	3	3.6666666666666665	0	3	0	3.6666666666666665	1.0	1	9.0	1	1	1	9.0	1.0	0.3701856698591431	0	1	0	0	0	0	0	0.0	0.0	0.3333333333333333	0	1	0	1	0	0	1	0	0	0	0	0	0.0	0.0	1.0	0	0	0	0	0
5366	5378	Однако меня уже понесло.	Теперь волосы требовали еще меньше ухода с моей стороны.	evaluation_r	4	5.25	1	4	1	5.25	1.0	9	5.333333333333333	1	9	1	5.333333333333333	1.0	0.5824823725107175	0	1	0	2	0	0	0	0.0	0.0	0.25	0	0	0	0	1	3	1	0	2	0	1	0	0.3333333333333333	0.0	0.1111111111111111	1	0	0	0	0
