level_0	index	EDU_1	EDU_2	Relation	num_of_words_1	avg_word_len_1	upcase_words_num_1	num_unique_words_1	count_words_title_1	mean_word_len_1	words_vs_unique_1	num_of_words_2	avg_word_len_2	upcase_words_num_2	num_unique_words_2	count_words_title_2	mean_word_len_2	words_vs_unique_2	bleu_score	nouns_count_1	verbs_count_1	adj_count_1	adv_count_1	aux_count_1	num_count_1	vbd_count_1	nouns_vs_words_1	adjectives_vs_words_1	verbs_vs_words_1	adp_count_1	cconj_count_1	sconj_count_1	part_count_1	pron_count_1	nouns_count_2	verbs_count_2	adj_count_2	adv_count_2	aux_count_2	num_count_2	vbd_count_2	nouns_vs_words_2	adjectives_vs_words_2	verbs_vs_words_2	adp_count_2	cconj_count_2	sconj_count_2	part_count_2	pron_count_2
3757	3766	для поступления.	Она говорила, что как раз вот радость от того, что она теперь всегда чувствует себя в порядке и дала ей силы	purpose_r	2	7.5	0	2	0	7.5	1.0	21	4.190476190476191	1	20	1	4.190476190476191	0.9523809523809523	0.37267799624996495	1	0	0	0	0	0	0	0.5	0.0	0.0	1	0	0	0	0	4	3	0	2	0	0	0	0.19047619047619047	0.0	0.14285714285714285	2	1	3	1	5
3758	3767	Кстати, еще один интересный факт.	то среди тех, кто с оперировался одновременно с моей подругой, была девушка, вызывавшая недоуменные взгляды.	preparation_r	5	5.8	1	5	1	5.8	1.0	15	6.266666666666667	0	14	0	6.266666666666667	0.9333333333333333	0.5091750772173155	1	0	1	2	0	1	0	0.2	0.2	0.0	0	0	0	0	0	3	3	1	1	0	0	0	0.2	0.06666666666666667	0.2	3	0	1	0	1
3759	3768	Когда ее готовили к операции,	то среди тех, кто с оперировался одновременно с моей подругой, была девушка, вызывавшая недоуменные взгляды.	condition_r	5	5.0	1	5	1	5.0	1.0	15	6.266666666666667	0	14	0	6.266666666666667	0.9333333333333333	0.4811252243246881	1	1	0	0	0	0	0	0.2	0.0	0.2	1	0	1	0	1	3	3	1	1	0	0	0	0.2	0.06666666666666667	0.2	3	0	1	0	1
3760	3769	а это в «институте красоты» делали почему-то для всех сразу,	Когда ее готовили к операции,	background_r	10	5.1	0	10	0	5.1	1.0	5	5.0	1	5	1	5.0	1.0	0.3123638711411434	2	1	0	2	0	0	0	0.2	0.0	0.1	2	1	0	0	2	1	1	0	0	0	0	0	0.2	0.0	0.2	1	0	1	0	1
3761	3770	то среди тех, кто с оперировался одновременно с моей подругой, была девушка, вызывавшая недоуменные взгляды.	Все выяснилось,	solutionhood_r	15	6.266666666666667	0	14	0	6.266666666666667	0.9333333333333333	2	7.0	1	2	1	7.0	1.0	0.0018892971038274914	3	3	1	1	0	0	0	0.2	0.06666666666666667	0.2	3	0	1	0	1	0	1	0	0	0	0	0	0.0	0.0	0.5	0	0	0	0	1
3762	3771	Она была просто красавица, с распущенными пышными волосами,	то среди тех, кто с оперировался одновременно с моей подругой, была девушка, вызывавшая недоуменные взгляды.	elaboration_r	8	6.5	1	8	1	6.5	1.0	15	6.266666666666667	0	14	0	6.266666666666667	0.9333333333333333	0.6804138174397717	2	1	1	0	1	0	0	0.25	0.125	0.125	1	0	0	1	1	3	3	1	1	0	0	0	0.2	0.06666666666666667	0.2	3	0	1	0	1
3763	3772	на первый взгляд, совершенно нечего оперировать.	Она была просто красавица, с распущенными пышными волосами,	evaluation_r	6	7.166666666666667	0	6	0	7.166666666666667	1.0	8	6.5	1	8	1	6.5	1.0	0.7130740328122925	1	1	1	1	0	0	0	0.16666666666666666	0.16666666666666666	0.16666666666666666	1	0	0	0	1	2	1	1	0	1	0	0	0.25	0.125	0.125	1	0	0	1	1
3764	3773	Остальные были со всяко-разно заметными носами, пара девушек с Кавказа, у которых нос «на двоих рос», девушка после аварии с вмятиной на лице,	то среди тех, кто с оперировался одновременно с моей подругой, была девушка, вызывавшая недоуменные взгляды.	comparison_m	23	5.217391304347826	2	22	2	5.217391304347826	0.9565217391304348	15	6.266666666666667	0	14	0	6.266666666666667	0.9333333333333333	0.688178977858995	8	1	2	1	1	1	0	0.34782608695652173	0.08695652173913043	0.043478260869565216	7	0	0	0	1	3	3	1	1	0	0	0	0.2	0.06666666666666667	0.2	3	0	1	0	1
3765	3774	а тут такая красотка…	Остальные были со всяко-разно заметными носами, пара девушек с Кавказа, у которых нос «на двоих рос», девушка после аварии с вмятиной на лице,	contrast_m	4	4.5	0	4	0	4.5	1.0	23	5.217391304347826	2	22	2	5.217391304347826	0.9565217391304348	0.37529331252040077	0	0	0	1	0	0	0	0.0	0.0	0.0	0	1	0	0	0	8	1	2	1	1	1	0	0.34782608695652173	0.08695652173913043	0.043478260869565216	7	0	0	0	1
3766	3775	Зачем?	то среди тех, кто с оперировался одновременно с моей подругой, была девушка, вызывавшая недоуменные взгляды.	evaluation_r	1	6.0	1	1	1	6.0	1.0	15	6.266666666666667	0	14	0	6.266666666666667	0.9333333333333333	0.16666666666666669	0	0	0	1	0	0	0	0.0	0.0	0.0	0	0	0	0	0	3	3	1	1	0	0	0	0.2	0.06666666666666667	0.2	3	0	1	0	1
3767	3776	когда все переоделись	Все выяснилось,	cause_r	3	6.333333333333333	0	3	0	6.333333333333333	1.0	2	7.0	1	2	1	7.0	1.0	0.519227674985004	0	1	0	0	0	0	0	0.0	0.0	0.3333333333333333	0	0	1	0	1	0	1	0	0	0	0	0	0.0	0.0	0.5	0	0	0	0	1
3768	3777	и убрали волосы под шапочку.	когда все переоделись	joint_m	5	4.8	0	5	0	4.8	1.0	3	6.333333333333333	0	3	0	6.333333333333333	1.0	0.5637638203320733	2	1	0	0	0	0	0	0.4	0.0	0.2	1	1	0	0	0	0	1	0	0	0	0	0	0.0	0.0	0.3333333333333333	0	0	1	0	1
3769	3778	Подруга рассказывала,	Все выяснилось,	elaboration_r	2	10.0	1	2	1	10.0	1.0	2	7.0	1	2	1	7.0	1.0	0.4895325466154947	1	1	0	0	0	0	0	0.5	0.0	0.5	0	0	0	0	0	0	1	0	0	0	0	0	0.0	0.0	0.5	0	0	0	0	1
3770	3779	что несмотря на мандраж перед операцией,	все невольно расползлись в улыбке.	concession_r	6	5.833333333333333	0	6	0	5.833333333333333	1.0	5	6.0	0	5	0	6.0	1.0	0.5927134732157671	2	0	0	1	0	0	0	0.3333333333333333	0.0	0.0	2	0	1	0	0	1	1	0	1	0	0	0	0.2	0.0	0.2	1	0	0	0	1
3771	3780	все невольно расползлись в улыбке.	Подруга рассказывала,	same-unit_m	5	6.0	0	5	0	6.0	1.0	2	10.0	1	2	1	10.0	1.0	0.40703523979887224	1	1	0	1	0	0	0	0.2	0.0	0.2	1	0	0	0	1	1	1	0	0	0	0	0	0.5	0.0	0.5	0	0	0	0	0
3772	3781	У этой красавицы одно ухо торчало строго перпендикулярно к голове,	Подруга рассказывала,	cause_r	10	5.7	1	10	1	5.7	1.0	2	10.0	1	2	1	10.0	1.0	0.10555620810550287	3	1	0	2	0	1	0	0.3	0.0	0.1	2	0	0	0	0	1	1	0	0	0	0	0	0.5	0.0	0.5	0	0	0	0	0
3773	3782	и вид у нее получался умилительно-забавный.	У этой красавицы одно ухо торчало строго перпендикулярно к голове,	joint_m	6	6.333333333333333	0	6	0	6.333333333333333	1.0	10	5.7	1	10	1	5.7	1.0	0.7071067811865476	1	1	1	0	0	0	0	0.16666666666666666	0.16666666666666666	0.16666666666666666	1	1	0	0	1	3	1	0	2	0	1	0	0.3	0.0	0.1	2	0	0	0	0
3774	3783	Как будто она одним ухом прислушивается, как щенок.	У этой красавицы одно ухо торчало строго перпендикулярно к голове,	comparison_m	8	5.5	1	8	1	5.5	1.0	10	5.7	1	10	1	5.7	1.0	0.778498944161523	2	1	0	1	0	1	0	0.25	0.0	0.125	0	0	1	1	1	3	1	0	2	0	1	0	0.3	0.0	0.1	2	0	0	0	0
3775	3784	Девушка на улыбки и ответила: «Знаете, как надоело работать клоуном?	Вот потому и делаю пластику,	solutionhood_r	10	5.9	2	10	2	5.9	1.0	5	4.8	1	5	1	4.8	1.0	0.2172021970386119	3	4	0	1	0	0	0	0.3	0.0	0.4	1	0	0	1	0	1	1	0	1	0	0	0	0.2	0.0	0.2	0	0	0	2	0
3776	3785	Вот потому и делаю пластику,	Подруга рассказывала,	evaluation_r	5	4.8	1	5	1	4.8	1.0	2	10.0	1	2	1	10.0	1.0	0.49445357961741204	1	1	0	1	0	0	0	0.2	0.0	0.2	0	0	0	2	0	1	1	0	0	0	0	0	0.5	0.0	0.5	0	0	0	0	0
3777	3786	что устала от таких улыбок.»	Вот потому и делаю пластику,	cause_r	5	4.8	0	5	0	4.8	1.0	5	4.8	1	5	1	4.8	1.0	0.823754471047914	1	1	0	0	0	0	0	0.2	0.0	0.2	1	0	1	0	0	1	1	0	1	0	0	0	0.2	0.0	0.2	0	0	0	2	0
3778	3787	пока ребенок особо ничего не понимает.	По этой причине уже много позже, взрослой, я предложила соседке, которая все умилялась на дочкины оттопыренные «лопушки», все же сделать операцию,	condition_r	6	5.5	0	6	0	5.5	1.0	21	6.0	1	20	1	6.0	0.9523809523809523	0.4896182465934662	1	1	0	1	0	0	0	0.16666666666666666	0.0	0.16666666666666666	0	0	1	1	1	4	4	1	3	0	0	0	0.19047619047619047	0.047619047619047616	0.19047619047619047	2	0	0	3	2
3779	3788	Что бы роль клоуна не приросла.	По этой причине уже много позже, взрослой, я предложила соседке, которая все умилялась на дочкины оттопыренные «лопушки», все же сделать операцию,	purpose_r	6	4.333333333333333	1	6	1	4.333333333333333	1.0	21	6.0	1	20	1	6.0	0.9523809523809523	0.4379278729628981	2	1	0	0	0	0	0	0.3333333333333333	0.0	0.16666666666666666	0	0	1	2	0	4	4	1	3	0	0	0	0.19047619047619047	0.047619047619047616	0.19047619047619047	2	0	0	3	2
3780	3789	Но тогда она даже слушать не стала.	По этой причине уже много позже, взрослой, я предложила соседке, которая все умилялась на дочкины оттопыренные «лопушки», все же сделать операцию,	contrast_m	7	4.142857142857143	1	7	1	4.142857142857143	1.0	21	6.0	1	20	1	6.0	0.9523809523809523	0.47542338737200757	0	2	0	1	0	0	0	0.0	0.0	0.2857142857142857	0	1	0	2	1	4	4	1	3	0	0	0	0.19047619047619047	0.047619047619047616	0.19047619047619047	2	0	0	3	2
3781	3790	И я уже была сильно взрослее	По этой причине уже много позже, взрослой, я предложила соседке, которая все умилялась на дочкины оттопыренные «лопушки», все же сделать операцию,	evaluation_r	6	3.8333333333333335	1	6	1	3.8333333333333335	1.0	21	6.0	1	20	1	6.0	0.9523809523809523	0.42199785755477703	0	0	1	2	1	0	0	0.0	0.16666666666666666	0.0	0	1	0	0	1	4	4	1	3	0	0	0	0.19047619047619047	0.047619047619047616	0.19047619047619047	2	0	0	3	2
3782	3791	и настаивать, конечно не стала.	И я уже была сильно взрослее	joint_m	5	5.4	0	5	0	5.4	1.0	6	3.8333333333333335	1	6	1	3.8333333333333335	1.0	0.6791245402324501	0	2	0	1	0	0	0	0.0	0.0	0.4	0	1	0	1	0	0	0	1	2	1	0	0	0.0	0.16666666666666666	0.0	0	1	0	0	1
3783	3792	А через какое-то время получила упрек от мамы, что вот «ты же психолог	чего же не настояла?»	cause_r	13	4.461538461538462	1	13	1	4.461538461538462	1.0	4	4.5	0	4	0	4.5	1.0	0.08724911334668012	4	1	0	0	0	0	0	0.3076923076923077	0.0	0.07692307692307693	2	1	1	2	1	0	1	0	0	0	0	0	0.0	0.0	0.25	0	0	0	2	1
3784	3793	(хотя тогда я психологом еще не была),	А через какое-то время получила упрек от мамы, что вот «ты же психолог	concession_r	7	4.571428571428571	0	7	0	4.571428571428571	1.0	13	4.461538461538462	1	13	1	4.461538461538462	1.0	0.6436503043467892	1	0	0	2	1	0	0	0.14285714285714285	0.0	0.0	0	0	1	1	1	4	1	0	0	0	0	0	0.3076923076923077	0.0	0.07692307692307693	2	1	1	2	1
3785	3794	чего же не настояла?»	И я уже была сильно взрослее	contrast_m	4	4.5	0	4	0	4.5	1.0	6	3.8333333333333335	1	6	1	3.8333333333333335	1.0	0.7071067811865476	0	1	0	0	0	0	0	0.0	0.0	0.25	0	0	0	2	1	0	0	1	2	1	0	0	0.0	0.16666666666666666	0.0	0	1	0	0	1
3786	3795	У девочки случилась нехорошая история с мальчиком, который ей нравился,	Ну и была попытка суицида, к счастью неудачная.	cause_r	10	6.2	1	10	1	6.2	1.0	8	5.0	1	8	1	5.0	1.0	0.5104146540660315	3	2	1	0	0	0	0	0.3	0.1	0.2	2	0	0	0	2	3	1	1	0	0	0	0	0.375	0.125	0.125	1	1	0	1	0
3787	3796	а он прилюдно и довольно зло проехался по ее ушам.	У девочки случилась нехорошая история с мальчиком, который ей нравился,	joint_m	10	4.1	0	10	0	4.1	1.0	10	6.2	1	10	1	6.2	1.0	0.7599110400121809	1	1	0	3	0	0	0	0.1	0.0	0.1	1	2	0	0	1	3	2	1	0	0	0	0	0.3	0.1	0.2	2	0	0	0	2
3788	3797	Ну и была попытка суицида, к счастью неудачная.	чего же не настояла?»	background_r	8	5.0	1	8	1	5.0	1.0	4	4.5	0	4	0	4.5	1.0	0.23673171289730427	3	1	1	0	0	0	0	0.375	0.125	0.125	1	1	0	1	0	0	1	0	0	0	0	0	0.0	0.0	0.25	0	0	0	2	1
3789	3798	Потом было много разных случаев с клиентами,	Так вот, клиентам иногда даже советовала к врачу косметологу сходить.	preparation_r	7	5.428571428571429	1	7	1	5.428571428571429	1.0	10	6.0	1	10	1	6.0	1.0	0.7322785563281032	2	1	1	2	0	0	0	0.2857142857142857	0.14285714285714285	0.14285714285714285	1	0	0	0	0	3	2	0	2	0	0	0	0.3	0.0	0.2	1	0	0	2	0
3790	3799	я даже где-то писала.	Потом было много разных случаев с клиентами,	joint_m	4	4.5	0	4	0	4.5	1.0	7	5.428571428571429	1	7	1	5.428571428571429	1.0	0.5640760748177662	0	1	0	1	0	0	0	0.0	0.0	0.25	0	0	0	1	1	2	1	1	2	0	0	0	0.2857142857142857	0.14285714285714285	0.14285714285714285	1	0	0	0	0
3791	3800	При хорошем контакте с клиентом	сказать можно многое.	condition_r	5	5.4	1	5	1	5.4	1.0	3	6.333333333333333	0	3	0	6.333333333333333	1.0	0.5249634727627139	2	0	1	0	0	0	0	0.4	0.2	0.0	2	0	0	0	0	1	1	0	1	0	0	0	0.3333333333333333	0.0	0.3333333333333333	0	0	0	0	0
3792	3801	сказать можно многое.	Так вот, клиентам иногда даже советовала к врачу косметологу сходить.	elaboration_r	3	6.333333333333333	0	3	0	6.333333333333333	1.0	10	6.0	1	10	1	6.0	1.0	0.5383819020581655	1	1	0	1	0	0	0	0.3333333333333333	0.0	0.3333333333333333	0	0	0	0	0	3	2	0	2	0	0	0	0.3	0.0	0.2	1	0	0	2	0
3793	3802	Например, тот же ботокс может быть серьезным вспомогательным средством	Так вот, клиентам иногда даже советовала к врачу косметологу сходить.	evidence_r	9	6.888888888888889	1	9	1	6.888888888888889	1.0	10	6.0	1	10	1	6.0	1.0	0.7870596896042593	2	1	2	1	1	0	0	0.2222222222222222	0.2222222222222222	0.1111111111111111	0	0	0	1	0	3	2	0	2	0	0	0	0.3	0.0	0.2	1	0	0	2	0
3794	3803	при психотерапии.	Например, тот же ботокс может быть серьезным вспомогательным средством	condition_r	2	8.0	0	2	0	8.0	1.0	9	6.888888888888889	1	9	1	6.888888888888889	1.0	0.3964124835860459	1	0	0	0	0	0	0	0.5	0.0	0.0	1	0	0	0	0	2	1	2	1	1	0	0	0.2222222222222222	0.2222222222222222	0.1111111111111111	0	0	0	1	0
3795	3804	Великолепно блокирует автоматический вход во многие привычные состояния.	Например, тот же ботокс может быть серьезным вспомогательным средством	elaboration_r	8	8.125	1	8	1	8.125	1.0	9	6.888888888888889	1	9	1	6.888888888888889	1.0	0.7963270993286158	2	1	2	1	0	1	0	0.25	0.25	0.125	1	0	0	0	0	2	1	2	1	1	0	0	0.2222222222222222	0.2222222222222222	0.1111111111111111	0	0	0	1	0
3796	3805	Лоб уже не хмурится,	соответственно уходит привычный автоматизм реакций.	cause_r	4	4.25	1	4	1	4.25	1.0	5	9.4	0	5	0	9.4	1.0	0.5239368319955838	1	1	0	1	0	0	0	0.25	0.0	0.25	0	0	0	1	0	2	1	1	1	0	0	0	0.4	0.2	0.2	0	0	0	0	0
3797	3806	а с гладким лбом накрутить себя в разы труднее	Лоб уже не хмурится,	contrast_m	9	4.222222222222222	0	9	0	4.222222222222222	1.0	4	4.25	1	4	1	4.25	1.0	0.24375984610158236	2	1	2	0	0	0	0	0.2222222222222222	0.2222222222222222	0.1111111111111111	2	1	0	0	1	1	1	0	1	0	0	0	0.25	0.0	0.25	0	0	0	1	0
3798	3807	(попробуйте,	а с гладким лбом накрутить себя в разы труднее	evidence_r	1	12.0	0	1	0	12.0	1.0	9	4.222222222222222	0	9	0	4.222222222222222	1.0	0.3611575592573076	0	1	0	0	0	0	0	0.0	0.0	1.0	0	0	0	0	0	2	1	2	0	0	0	0	0.2222222222222222	0.2222222222222222	0.1111111111111111	2	1	0	0	1
3799	3808	сохраняя гладкое лицо,	воспроизвести в себе какое-либо состояние из списка «все люди – гады!»),	condition_r	3	6.666666666666667	0	3	0	6.666666666666667	1.0	11	5.636363636363637	0	11	0	5.636363636363637	1.0	0.5137011669140814	1	1	1	0	0	0	0	0.3333333333333333	0.3333333333333333	0.3333333333333333	0	0	0	0	0	4	1	0	0	0	0	0	0.36363636363636365	0.0	0.09090909090909091	2	0	0	0	1
3800	3809	воспроизвести в себе какое-либо состояние из списка «все люди – гады!»),	(попробуйте,	same-unit_m	11	5.636363636363637	0	11	0	5.636363636363637	1.0	1	12.0	0	1	0	12.0	1.0	0.005835233270561139	4	1	0	0	0	0	0	0.36363636363636365	0.0	0.09090909090909091	2	0	0	0	1	0	1	0	0	0	0	0	0.0	0.0	1.0	0	0	0	0	0
3801	3810	соответственно уходит привычный автоматизм реакций.	Великолепно блокирует автоматический вход во многие привычные состояния.	elaboration_r	5	9.4	0	5	0	9.4	1.0	8	8.125	1	8	1	8.125	1.0	0.7905694150420948	2	1	1	1	0	0	0	0.4	0.2	0.2	0	0	0	0	0	2	1	2	1	0	1	0	0.25	0.25	0.125	1	0	0	0	0
3802	3811	Но вот об одной вещи хочу обязательно рассказать.	Есть такое фактически расстройство психики, как дисморфофобия.	preparation_r	8	5.25	1	8	1	5.25	1.0	7	8.0	1	7	1	8.0	1.0	0.7513428837969107	1	2	0	1	0	1	0	0.125	0.0	0.25	1	1	0	1	0	3	1	0	1	0	0	0	0.42857142857142855	0.0	0.14285714285714285	0	0	1	0	0
3803	3812	И тут я хочу описать один грубый, но заметный признак, по которому становится понятно, что лучше работать уже не с психологом, а с психиатром.	Есть такое фактически расстройство психики, как дисморфофобия.	elaboration_r	24	4.958333333333333	1	23	1	4.958333333333333	0.9583333333333334	7	8.0	1	7	1	8.0	1.0	0.2568153974912907	3	4	4	2	0	1	0	0.125	0.16666666666666666	0.16666666666666666	3	3	1	1	2	3	1	0	1	0	0	0	0.42857142857142855	0.0	0.14285714285714285	0	0	1	0	0
3804	3813	Это когда клиент,	Есть такое фактически расстройство психики, как дисморфофобия.	elaboration_r	3	5.0	1	3	1	5.0	1.0	7	8.0	1	7	1	8.0	1.0	0.4579054698896255	1	0	0	0	0	0	0	0.3333333333333333	0.0	0.0	0	0	1	0	1	3	1	0	1	0	0	0	0.42857142857142855	0.0	0.14285714285714285	0	0	1	0	0
3805	3814	имея во внешности действительно заметный дефект	зафиксирован совсем на другом.	condition_r	6	7.0	0	6	0	7.0	1.0	4	6.75	0	4	0	6.75	1.0	0.4859040362674119	2	1	1	1	0	0	0	0.3333333333333333	0.16666666666666666	0.16666666666666666	1	0	0	0	0	0	1	1	1	0	0	0	0.0	0.25	0.25	1	0	0	0	0
3806	3815	(нос там кривой или очень плохую кожу)	имея во внешности действительно заметный дефект	evidence_r	7	4.571428571428571	0	7	0	4.571428571428571	1.0	6	7.0	0	6	0	7.0	1.0	0.6995439243733445	2	0	2	2	0	0	0	0.2857142857142857	0.2857142857142857	0.0	0	1	0	0	0	2	1	1	1	0	0	0	0.3333333333333333	0.16666666666666666	0.16666666666666666	1	0	0	0	0
3807	3816	зафиксирован совсем на другом.	Это когда клиент,	same-unit_m	4	6.75	0	4	0	6.75	1.0	3	5.0	1	3	1	5.0	1.0	0.3744245675849849	0	1	1	1	0	0	0	0.0	0.25	0.25	1	0	0	0	0	1	0	0	0	0	0	0	0.3333333333333333	0.0	0.0	0	0	1	0	1
3808	3817	Например,	Это когда клиент,	evidence_r	1	9.0	1	1	1	9.0	1.0	3	5.0	1	3	1	5.0	1.0	0.485071250072666	0	0	0	1	0	0	0	0.0	0.0	0.0	0	0	0	0	0	1	0	0	0	0	0	0	0.3333333333333333	0.0	0.0	0	0	1	0	1
3809	3818	при явно выраженной кривизне носа	человек сосредоточен на форме груди или повышенной волосатости на руках.	condition_r	5	5.8	0	5	0	5.8	1.0	10	6.3	0	9	0	6.3	0.9	0.6454972243679028	2	1	0	1	0	0	0	0.4	0.0	0.2	1	0	0	0	0	5	2	0	0	0	0	0	0.5	0.0	0.2	2	1	0	0	0
3810	3819	человек сосредоточен на форме груди или повышенной волосатости на руках.	Например,	same-unit_m	10	6.3	0	9	0	6.3	0.9	1	9.0	1	1	1	9.0	1.0	0.000804204301967339	5	2	0	0	0	0	0	0.5	0.0	0.2	2	1	0	0	0	0	0	0	1	0	0	0	0.0	0.0	0.0	0	0	0	0	0
3811	3820	И если при этом были какие-то дико радикальные попытки самому себе что-то исправить.	Например,	joint_m	13	5.538461538461538	1	13	1	5.538461538461538	1.0	1	9.0	1	1	1	9.0	1.0	0.0002119859524589462	1	2	2	1	0	0	0	0.07692307692307693	0.15384615384615385	0.15384615384615385	1	1	1	0	3	0	0	0	1	0	0	0	0.0	0.0	0.0	0	0	0	0	0
3812	3821	Так вот, учтите, если это ваш близкий,	то ищите психиатра.	condition_r	7	4.571428571428571	1	7	1	4.571428571428571	1.0	3	5.666666666666667	0	3	0	5.666666666666667	1.0	0.3157859005979391	0	1	1	1	0	0	0	0.0	0.14285714285714285	0.14285714285714285	0	0	1	1	1	1	1	0	0	0	0	0	0.3333333333333333	0.0	0.3333333333333333	0	0	1	0	0
3813	3822	то ищите психиатра.	Есть такое фактически расстройство психики, как дисморфофобия.	evaluation_r	3	5.666666666666667	0	3	0	5.666666666666667	1.0	7	8.0	1	7	1	8.0	1.0	0.5388159060803247	1	1	0	0	0	0	0	0.3333333333333333	0.0	0.3333333333333333	0	0	1	0	0	3	1	0	1	0	0	0	0.42857142857142855	0.0	0.14285714285714285	0	0	1	0	0
3814	3823	Очень может пригодится.	то ищите психиатра.	evaluation_r	3	7.0	1	3	1	7.0	1.0	3	5.666666666666667	0	3	0	5.666666666666667	1.0	0.6438480805467145	0	2	0	1	0	0	0	0.0	0.0	0.6666666666666666	0	0	0	0	0	1	1	0	0	0	0	0	0.3333333333333333	0.0	0.3333333333333333	0	0	1	0	0
3815	3824	Когда, на ваш взгляд, полезны операции по увеличению груди?	А вам я сейчас задам один вопрос на эту тему.	elaboration_r	9	5.666666666666667	1	9	1	5.666666666666667	1.0	10	3.6	1	10	1	3.6	1.0	0.608080044371997	4	0	1	1	0	0	0	0.4444444444444444	0.1111111111111111	0.0	2	0	0	0	0	2	1	0	1	0	1	0	0.2	0.0	0.1	1	1	0	0	2
3816	3825	Когда полезны операции по уменьшению груди?	Когда, на ваш взгляд, полезны операции по увеличению груди?	joint_m	6	6.333333333333333	1	6	1	6.333333333333333	1.0	9	5.666666666666667	1	9	1	5.666666666666667	1.0	0.8336157713463008	3	0	1	1	0	0	0	0.5	0.16666666666666666	0.0	1	0	0	0	0	4	0	1	1	0	0	0	0.4444444444444444	0.1111111111111111	0.0	2	0	0	0	0
3817	3826	Какие факторы тут работают?	Когда, на ваш взгляд, полезны операции по увеличению груди?	joint_m	4	6.0	1	4	1	6.0	1.0	9	5.666666666666667	1	9	1	5.666666666666667	1.0	0.552344770738994	1	1	0	1	0	0	0	0.25	0.0	0.25	0	0	0	0	0	4	0	1	1	0	0	0	0.4444444444444444	0.1111111111111111	0.0	2	0	0	0	0
3818	3827	Когда это блажь,	Когда, на ваш взгляд, полезны операции по увеличению груди?	joint_m	3	4.666666666666667	1	3	1	4.666666666666667	1.0	9	5.666666666666667	1	9	1	5.666666666666667	1.0	0.4317877695883728	1	0	0	0	0	0	0	0.3333333333333333	0.0	0.0	0	0	1	0	1	4	0	1	1	0	0	0	0.4444444444444444	0.1111111111111111	0.0	2	0	0	0	0
3819	3828	а когда необходимость?	Когда это блажь,	contrast_m	3	6.666666666666667	0	3	0	6.666666666666667	1.0	3	4.666666666666667	1	3	1	4.666666666666667	1.0	0.5698701650459056	1	0	0	1	0	0	0	0.3333333333333333	0.0	0.0	0	1	0	0	0	1	0	0	0	0	0	0	0.3333333333333333	0.0	0.0	0	0	1	0	1
