level_0	index	EDU_1	EDU_2	Relation	num_of_words_1	avg_word_len_1	upcase_words_num_1	num_unique_words_1	count_words_title_1	mean_word_len_1	words_vs_unique_1	num_of_words_2	avg_word_len_2	upcase_words_num_2	num_unique_words_2	count_words_title_2	mean_word_len_2	words_vs_unique_2	bleu_score	nouns_count_1	verbs_count_1	adj_count_1	adv_count_1	aux_count_1	num_count_1	vbd_count_1	nouns_vs_words_1	adjectives_vs_words_1	verbs_vs_words_1	adp_count_1	cconj_count_1	sconj_count_1	part_count_1	pron_count_1	nouns_count_2	verbs_count_2	adj_count_2	adv_count_2	aux_count_2	num_count_2	vbd_count_2	nouns_vs_words_2	adjectives_vs_words_2	verbs_vs_words_2	adp_count_2	cconj_count_2	sconj_count_2	part_count_2	pron_count_2
3858	3867	её вполне можно рассматривать как альтернативу основной трассе,	Дорога в хорошем состоянии,	evaluation_r	8	7.0	0	8	0	7.0	1.0	4	6.0	1	4	1	6.0	1.0	0.23794147482269926	2	1	1	2	0	0	0	0.25	0.125	0.125	0	0	1	0	1	2	0	1	0	0	0	0	0.5	0.25	0.0	1	0	0	0	0
3859	3868	если захочется разнообразия.	её вполне можно рассматривать как альтернативу основной трассе,	condition_r	3	8.666666666666666	0	3	0	8.666666666666666	1.0	8	7.0	0	8	0	7.0	1.0	0.549169647365276	1	1	0	0	0	0	0	0.3333333333333333	0.0	0.3333333333333333	0	0	1	0	0	2	1	1	2	0	0	0	0.25	0.125	0.125	0	0	1	0	1
3860	3869	Только смотреть на ней особо нечего,	Дорога в хорошем состоянии,	contrast_m	6	5.166666666666667	1	6	1	5.166666666666667	1.0	4	6.0	1	4	1	6.0	1.0	0.6010769736132971	0	1	0	1	0	0	0	0.0	0.0	0.16666666666666666	1	0	0	1	2	2	0	1	0	0	0	0	0.5	0.25	0.0	1	0	0	0	0
3861	3870	за исключением, пожалуй, находящегося немного в стороне Метехского храма.	Только смотреть на ней особо нечего,	concession_r	9	7.222222222222222	1	9	1	7.222222222222222	1.0	6	5.166666666666667	1	6	1	5.166666666666667	1.0	0.3373381984561591	3	1	0	2	0	0	0	0.3333333333333333	0.0	0.1111111111111111	2	0	0	0	0	0	1	0	1	0	0	0	0.0	0.0	0.16666666666666666	1	0	0	1	2
3862	3871	Остальные достопримечательности требуют углубления и съезда в сторону	Дорога в хорошем состоянии,	elaboration_r	8	7.75	1	8	1	7.75	1.0	4	6.0	1	4	1	6.0	1.0	0.19052863859572333	4	1	1	0	0	0	0	0.5	0.125	0.125	1	1	0	0	0	2	0	1	0	0	0	0	0.5	0.25	0.0	1	0	0	0	0
3863	3872	или имеют второстепенное значение.	Остальные достопримечательности требуют углубления и съезда в сторону	joint_m	4	7.75	0	4	0	7.75	1.0	8	7.75	1	8	1	7.75	1.0	0.6915640748081247	1	1	1	0	0	0	0	0.25	0.25	0.25	0	1	0	0	0	4	1	1	0	0	0	0	0.5	0.125	0.125	1	1	0	0	0
3864	3873	Проехав село Кавтисхеви,	сворачиваем с основной дороги	condition_r	3	7.333333333333333	2	3	2	7.333333333333333	1.0	4	6.5	0	4	0	6.5	1.0	0.7191949522280763	1	1	0	0	0	0	0	0.3333333333333333	0.0	0.3333333333333333	0	0	0	0	0	1	1	1	0	0	0	0	0.25	0.25	0.25	1	0	0	0	0
3865	3874	сворачиваем с основной дороги	Поездка началась с Армазской дороги (Гори-Кавтисхеви-Мцхета),	sequence_m	4	6.5	0	4	0	6.5	1.0	6	9.333333333333334	3	6	3	9.333333333333334	1.0	0.652862549237373	1	1	1	0	0	0	0	0.25	0.25	0.25	1	0	0	0	0	2	1	1	0	0	0	0	0.3333333333333333	0.16666666666666666	0.16666666666666666	1	0	0	0	0
3866	3875	и держим направление в сторону Цинарехи.	сворачиваем с основной дороги	sequence_m	6	5.833333333333333	1	6	1	5.833333333333333	1.0	4	6.5	0	4	0	6.5	1.0	0.5539179154681878	2	1	0	0	0	0	0	0.3333333333333333	0.0	0.16666666666666666	1	1	0	0	0	1	1	1	0	0	0	0	0.25	0.25	0.25	1	0	0	0	0
3867	3876	Дорога между двумя селами огибает складку земной поверхности, образовавшую небольшую гору, на которой ведется (или велась) добыча известняка и его обжиг.	сворачиваем с основной дороги	elaboration_r	21	6.333333333333333	1	21	1	6.333333333333333	1.0	4	6.5	0	4	0	6.5	1.0	0.013900060741464356	8	4	2	0	0	1	0	0.38095238095238093	0.09523809523809523	0.19047619047619047	2	2	0	0	2	1	1	1	0	0	0	0	0.25	0.25	0.25	1	0	0	0	0
3868	3877	Печи	так что сами по себе являются памятником грузинской мелкой промышленности времен Российской империи.	cause_r	1	4.0	1	1	1	4.0	1.0	13	6.769230769230769	1	13	1	6.769230769230769	1.0	0.17320508075688773	0	1	0	0	0	0	0	0.0	0.0	1.0	0	0	0	0	0	4	1	4	1	0	0	0	0.3076923076923077	0.3076923076923077	0.07692307692307693	1	0	1	0	1
3869	3878	для отжига,	Печи	purpose_r	2	5.0	0	2	0	5.0	1.0	1	4.0	1	1	1	4.0	1.0	0.08688697172522257	1	0	0	0	0	0	0	0.5	0.0	0.0	1	0	0	0	0	0	1	0	0	0	0	0	0.0	0.0	1.0	0	0	0	0	0
3870	3879	вполне может быть, построены еще в XIX веке,	Печи	same-unit_m	8	4.625	0	8	0	4.625	1.0	1	4.0	1	1	1	4.0	1.0	2.2699964881242427e-05	1	3	0	2	0	1	0	0.125	0.0	0.375	1	0	0	0	0	0	1	0	0	0	0	0	0.0	0.0	1.0	0	0	0	0	0
3871	3880	так что сами по себе являются памятником грузинской мелкой промышленности времен Российской империи.	Дорога между двумя селами огибает складку земной поверхности, образовавшую небольшую гору, на которой ведется (или велась) добыча известняка и его обжиг.	elaboration_r	13	6.769230769230769	1	13	1	6.769230769230769	1.0	21	6.333333333333333	1	21	1	6.333333333333333	1.0	0.7540739028638984	4	1	4	1	0	0	0	0.3076923076923077	0.3076923076923077	0.07692307692307693	1	0	1	0	1	8	4	2	0	0	1	0	0.38095238095238093	0.09523809523809523	0.19047619047619047	2	2	0	0	2
3872	3881	Наперегонки с поездом. Железная дорога от Тбилиси до самого Хашури тянется вдоль Куры, периодически меняя берега. Уплисцихе, между прочим, где-то на той стороне. Грузия, Кавчурское ущелье  Печи для получения извести. Грузия, Кавчурское ущелье	Дорога между двумя селами огибает складку земной поверхности, образовавшую небольшую гору, на которой ведется (или велась) добыча известняка и его обжиг.	elaboration_r	33	6.333333333333333	11	30	11	6.333333333333333	0.9090909090909091	21	6.333333333333333	1	21	1	6.333333333333333	1.0	0.5308416758062626	8	2	2	3	0	0	0	0.24242424242424243	0.06060606060606061	0.06060606060606061	7	0	0	0	1	8	4	2	0	0	1	0	0.38095238095238093	0.09523809523809523	0.19047619047619047	2	2	0	0	2
3873	3882	лежащим у подножия лесистого склона хребта,	За селом Цинарехи,	background_r	6	6.333333333333333	0	6	0	6.333333333333333	1.0	3	5.333333333333333	2	3	2	5.333333333333333	1.0	0.2350915169736932	3	1	1	0	0	0	0	0.5	0.16666666666666666	0.16666666666666666	1	0	0	0	0	1	0	0	0	0	0	0	0.3333333333333333	0.0	0.0	1	0	0	0	0
3874	3883	дорога уже неразлучно петляет вдоль левого берега реки Кавтура.	За селом Цинарехи,	same-unit_m	9	6.111111111111111	1	9	1	6.111111111111111	1.0	3	5.333333333333333	2	3	2	5.333333333333333	1.0	0.06416879519843659	3	1	1	2	0	0	0	0.3333333333333333	0.1111111111111111	0.1111111111111111	1	0	0	0	0	1	0	0	0	0	0	0	0.3333333333333333	0.0	0.0	1	0	0	0	0
3875	3884	И становится очевидно, что мы поднимаемся в гору.	За селом Цинарехи,	evaluation_r	8	5.25	1	8	1	5.25	1.0	3	5.333333333333333	2	3	2	5.333333333333333	1.0	0.15757095151224554	1	2	1	0	0	0	0	0.125	0.125	0.25	1	1	1	0	1	1	0	0	0	0	0	0	0.3333333333333333	0.0	0.0	1	0	0	0	0
3876	3885	Примерно в двух километрах от центра Цинарехи находится церковный комплекс князей Магаладзе,	За селом Цинарехи,	elaboration_r	12	6.75	3	12	3	6.75	1.0	3	5.333333333333333	2	3	2	5.333333333333333	1.0	0.015927783288119165	4	1	1	1	0	1	0	0.3333333333333333	0.08333333333333333	0.08333333333333333	2	0	0	0	0	1	0	0	0	0	0	0	0.3333333333333333	0.0	0.0	1	0	0	0	0
3877	3886	но заедем мы туда на обратном пути.	Примерно в двух километрах от центра Цинарехи находится церковный комплекс князей Магаладзе,	contrast_m	7	4.142857142857143	0	7	0	4.142857142857143	1.0	12	6.75	3	12	3	6.75	1.0	0.5897678246195885	1	1	1	1	0	0	0	0.14285714285714285	0.14285714285714285	0.14285714285714285	1	1	0	0	1	4	1	1	1	0	1	0	0.3333333333333333	0.08333333333333333	0.08333333333333333	2	0	0	0	0
3878	3887	Грузия, Кавчурское ущелье	За селом Цинарехи,	elaboration_r	3	7.666666666666667	2	3	2	7.666666666666667	1.0	3	5.333333333333333	2	3	2	5.333333333333333	1.0	0.5298681211393388	1	0	0	0	0	0	0	0.3333333333333333	0.0	0.0	0	0	0	0	0	1	0	0	0	0	0	0	0.3333333333333333	0.0	0.0	1	0	0	0	0
3879	3888	От комплекса до монастыря Кватахеви 4 км.	В середине этого отрезка сооружен мост,	background_r	7	5.0	2	7	2	5.0	1.0	6	5.666666666666667	1	6	1	5.666666666666667	1.0	0.7135222575497908	3	0	0	0	0	1	0	0.42857142857142855	0.0	0.0	2	0	0	0	0	3	1	0	0	0	0	0	0.5	0.0	0.16666666666666666	1	0	0	0	0
3880	3889	свернув на который,	мы ненадолго прощаемся с рекой Кавтура	cause_r	3	5.666666666666667	0	3	0	5.666666666666667	1.0	6	5.5	1	6	1	5.5	1.0	0.6688560540599386	0	1	0	0	0	0	0	0.0	0.0	0.3333333333333333	1	0	0	0	1	1	1	0	1	0	0	0	0.16666666666666666	0.0	0.16666666666666666	1	0	0	0	1
3881	3890	мы ненадолго прощаемся с рекой Кавтура	В середине этого отрезка сооружен мост,	elaboration_r	6	5.5	1	6	1	5.5	1.0	6	5.666666666666667	1	6	1	5.666666666666667	1.0	0.816496580927726	1	1	0	1	0	0	0	0.16666666666666666	0.0	0.16666666666666666	1	0	0	0	1	3	1	0	0	0	0	0	0.5	0.0	0.16666666666666666	1	0	0	0	0
3882	3891	и продолжаем движение сквозь живописный лес соседнего ущелья.	мы ненадолго прощаемся с рекой Кавтура	joint_m	8	6.75	0	8	0	6.75	1.0	6	5.5	1	6	1	5.5	1.0	0.4850721933146673	3	1	2	0	0	0	0	0.375	0.25	0.125	1	1	0	0	0	1	1	0	1	0	0	0	0.16666666666666666	0.0	0.16666666666666666	1	0	0	0	1
3883	3892	Основная же дорога уходит куда-то на юг к селу Ботиси,	В середине этого отрезка сооружен мост,	comparison_m	10	4.5	2	10	2	4.5	1.0	6	5.666666666666667	1	6	1	5.666666666666667	1.0	0.5970242677912458	3	1	1	1	0	0	0	0.3	0.1	0.1	2	0	0	1	0	3	1	0	0	0	0	0	0.5	0.0	0.16666666666666666	1	0	0	0	0
3884	3893	на ней можно увидеть развалины давно заброшенных домов, судя по всему, построенных в древности.	Основная же дорога уходит куда-то на юг к селу Ботиси,	elaboration_r	14	5.857142857142857	0	14	0	5.857142857142857	1.0	10	4.5	2	10	2	4.5	1.0	0.43195641618128905	3	4	0	2	0	0	0	0.21428571428571427	0.0	0.2857142857142857	3	0	0	0	2	3	1	1	1	0	0	0	0.3	0.1	0.1	2	0	0	1	0
3885	3894	Есть ли жизнь в Ботиси	Основная же дорога уходит куда-то на юг к селу Ботиси,	evaluation_r	5	3.6	2	5	2	3.6	1.0	10	4.5	2	10	2	4.5	1.0	0.5610836076867821	1	1	0	0	0	0	0	0.2	0.0	0.2	1	0	0	1	0	3	1	1	1	0	0	0	0.3	0.1	0.1	2	0	0	1	0
3886	3895	— непонятно,	Есть ли жизнь в Ботиси	evaluation_r	2	5.5	0	2	0	5.5	1.0	5	3.6	2	5	2	3.6	1.0	0.4264014327112209	0	0	1	0	0	0	0	0.0	0.5	0.0	0	0	0	0	0	1	1	0	0	0	0	0	0.2	0.0	0.2	1	0	0	1	0
3887	3896	но видно, что дорогой иногда пользуются.	Есть ли жизнь в Ботиси	contrast_m	6	5.833333333333333	0	6	0	5.833333333333333	1.0	5	3.6	2	5	2	3.6	1.0	0.3643362972567473	1	1	0	2	0	0	0	0.16666666666666666	0.0	0.16666666666666666	0	1	1	0	0	1	1	0	0	0	0	0	0.2	0.0	0.2	1	0	0	1	0
3888	3897	Сюда мы еще вернемся.	Основная же дорога уходит куда-то на юг к селу Ботиси,	evaluation_r	4	4.5	1	4	1	4.5	1.0	10	4.5	2	10	2	4.5	1.0	0.49065338146265813	0	1	0	2	0	0	0	0.0	0.0	0.25	0	0	0	0	1	3	1	1	1	0	0	0	0.3	0.1	0.1	2	0	0	1	0
3889	3898	Дорога к Кватахеви (снято на обратном пути). Грузия, Кавчурское ущелье, Кватахеви	В середине этого отрезка сооружен мост,	elaboration_r	11	6.454545454545454	5	10	5	6.454545454545454	0.9090909090909091	6	5.666666666666667	1	6	1	5.666666666666667	1.0	0.31805732737675957	3	1	1	0	0	0	0	0.2727272727272727	0.09090909090909091	0.09090909090909091	2	0	0	0	0	3	1	0	0	0	0	0	0.5	0.0	0.16666666666666666	1	0	0	0	0
3890	3899	Кватахеви появляется довольно эффектно	Территория монастыря огорожена стеной, на вид имеющей возраст в несколько столетий.	preparation_r	4	8.75	1	4	1	8.75	1.0	11	6.636363636363637	1	11	1	6.636363636363637	1.0	0.6012036120421518	1	1	0	2	0	0	0	0.25	0.0	0.25	0	0	0	0	0	6	2	0	0	0	1	0	0.5454545454545454	0.0	0.18181818181818182	2	0	0	0	0
3891	3900	— среди деревьев начинает проглядывать внушительный купол собора.	Кватахеви появляется довольно эффектно	elaboration_r	8	7.25	0	8	0	7.25	1.0	4	8.75	1	4	1	8.75	1.0	0.436607479041576	3	2	1	0	0	0	0	0.375	0.125	0.25	1	0	0	0	0	1	1	0	2	0	0	0	0.25	0.0	0.25	0	0	0	0	0
3892	3901	В стену врезан современный проход, до которого через ущелье переброшен пешеходный мост.	Территория монастыря огорожена стеной, на вид имеющей возраст в несколько столетий.	joint_m	12	6.333333333333333	1	12	1	6.333333333333333	1.0	11	6.636363636363637	1	11	1	6.636363636363637	1.0	0.8169510151503179	4	2	2	0	0	0	0	0.3333333333333333	0.16666666666666666	0.16666666666666666	3	0	0	0	1	6	2	0	0	0	1	0	0.5454545454545454	0.0	0.18181818181818182	2	0	0	0	0
3893	3902	Изначально в монастырь входили через ворота, расположенные ровно на противоположной стороне стены со стороны горного склона.	В стену врезан современный проход, до которого через ущелье переброшен пешеходный мост.	background_r	16	6.8125	1	16	1	6.8125	1.0	12	6.333333333333333	1	12	1	6.333333333333333	1.0	0.5778230707948016	6	1	3	2	0	0	0	0.375	0.1875	0.0625	4	0	0	0	0	4	2	2	0	0	0	0	0.3333333333333333	0.16666666666666666	0.16666666666666666	3	0	0	0	1
3894	3903	Там и сейчас автомобильный въезд и сторожевая башня, в которой теперь голубятня.	В стену врезан современный проход, до которого через ущелье переброшен пешеходный мост.	elaboration_r	12	5.75	1	11	1	5.75	0.9166666666666666	12	6.333333333333333	1	12	1	6.333333333333333	1.0	0.8094272134003795	3	0	2	3	0	0	0	0.25	0.16666666666666666	0.0	1	1	0	1	1	4	2	2	0	0	0	0	0.3333333333333333	0.16666666666666666	0.16666666666666666	3	0	0	0	1
3895	3904	Могу предположить, что в зимнее время со стороны горы наносит прилично снега,	поэтому для удобства соорудили современный проход.	cause_r	12	5.5	1	12	1	5.5	1.0	6	7.5	0	6	0	7.5	1.0	0.5212258824309776	4	3	1	1	0	0	0	0.3333333333333333	0.08333333333333333	0.25	2	0	1	0	0	2	1	1	1	0	0	0	0.3333333333333333	0.16666666666666666	0.16666666666666666	1	0	0	0	0
3896	3905	и ворота бывают завалены,	Могу предположить, что в зимнее время со стороны горы наносит прилично снега,	joint_m	4	5.5	0	4	0	5.5	1.0	12	5.5	1	12	1	5.5	1.0	0.5096471914376255	1	2	0	0	0	0	0	0.25	0.0	0.5	0	1	0	0	0	4	3	1	1	0	0	0	0.3333333333333333	0.08333333333333333	0.25	2	0	1	0	0
3897	3906	поэтому для удобства соорудили современный проход.	Там и сейчас автомобильный въезд и сторожевая башня, в которой теперь голубятня.	evaluation_r	6	7.5	0	6	0	7.5	1.0	12	5.75	1	11	1	5.75	0.9166666666666666	0.724568837309472	2	1	1	1	0	0	0	0.3333333333333333	0.16666666666666666	0.16666666666666666	1	0	0	0	0	3	0	2	3	0	0	0	0.25	0.16666666666666666	0.0	1	1	0	1	1
3898	3907	Впрочем, внешний вид эта перестройка не испортила, а даже наоборот.	Там и сейчас автомобильный въезд и сторожевая башня, в которой теперь голубятня.	evaluation_r	10	5.8	1	10	1	5.8	1.0	12	5.75	1	11	1	5.75	0.9166666666666666	0.82915619758885	2	1	1	2	0	0	0	0.2	0.1	0.1	0	1	0	2	0	3	0	2	3	0	0	0	0.25	0.16666666666666666	0.0	1	1	0	1	1
3899	3908	Приехала туристическая группа. Грузия, Кавчурское ущелье, Кватахеви  Мостик, ведущий ко входу в монастырь. Грузия, Кавчурское ущелье, Кватахеви	Территория монастыря огорожена стеной, на вид имеющей возраст в несколько столетий.	elaboration_r	17	7.411764705882353	8	13	8	7.411764705882353	0.7647058823529411	11	6.636363636363637	1	11	1	6.636363636363637	1.0	0.4425248677249549	5	2	1	0	0	0	0	0.29411764705882354	0.058823529411764705	0.11764705882352941	2	0	0	0	0	6	2	0	0	0	1	0	0.5454545454545454	0.0	0.18181818181818182	2	0	0	0	0
3900	3909	Монастырь в честь Успения Пресвятой Богородицы был основан на рубеже XII—XIII веков,	Ква по-грузински означает камень, хеви - ущелье,	preparation_r	12	6.083333333333333	4	12	4	6.083333333333333	1.0	7	6.0	1	7	1	6.0	1.0	0.40335973411860293	4	1	1	0	1	1	0	0.3333333333333333	0.08333333333333333	0.08333333333333333	2	0	0	0	0	2	1	0	1	0	0	0	0.2857142857142857	0.0	0.14285714285714285	0	0	0	0	0
3901	3910	во всяком случае в этот период о нем появляются первые упоминания в летописях.	Монастырь в честь Успения Пресвятой Богородицы был основан на рубеже XII—XIII веков,	elaboration_r	13	5.076923076923077	0	12	0	5.076923076923077	0.9230769230769231	12	6.083333333333333	4	12	4	6.083333333333333	1.0	0.809173593712687	4	1	1	0	0	0	0	0.3076923076923077	0.07692307692307693	0.07692307692307693	4	0	0	0	1	4	1	1	0	1	1	0	0.3333333333333333	0.08333333333333333	0.08333333333333333	2	0	0	0	0
3902	3911	И даже какое-то время имел славу главного культового сооружения в Картли.	Монастырь в честь Успения Пресвятой Богородицы был основан на рубеже XII—XIII веков,	joint_m	11	5.7272727272727275	2	11	2	5.7272727272727275	1.0	12	6.083333333333333	4	12	4	6.083333333333333	1.0	0.7867957924694432	3	1	2	0	0	0	0	0.2727272727272727	0.18181818181818182	0.09090909090909091	1	1	0	1	0	4	1	1	0	1	1	0	0.3333333333333333	0.08333333333333333	0.08333333333333333	2	0	0	0	0
3903	3912	то есть Кватахеви можно перевести как каменистое ущелье.	Ква по-грузински означает камень, хеви - ущелье,	restatement_m	8	6.125	1	8	1	6.125	1.0	7	6.0	1	7	1	6.0	1.0	0.7531626346309606	1	2	1	1	0	0	0	0.125	0.125	0.25	0	0	1	0	1	2	1	0	1	0	0	0	0.2857142857142857	0.0	0.14285714285714285	0	0	0	0	0
3904	3913	Вообще, река Кавтура известна узкими ущельями, прорезанными в скале,	Ква по-грузински означает камень, хеви - ущелье,	background_r	9	6.666666666666667	2	9	2	6.666666666666667	1.0	7	6.0	1	7	1	6.0	1.0	0.6166631434127495	3	1	2	1	0	0	0	0.3333333333333333	0.2222222222222222	0.1111111111111111	1	0	0	0	0	2	1	0	1	0	0	0	0.2857142857142857	0.0	0.14285714285714285	0	0	0	0	0
3905	3914	и даже имеет небольшие водопады, находящиеся в основном вверх по течению - в местах совсем глухих и заповедных...	Вообще, река Кавтура известна узкими ущельями, прорезанными в скале,	joint_m	18	5.333333333333333	0	16	0	5.333333333333333	0.8888888888888888	9	6.666666666666667	2	9	2	6.666666666666667	1.0	0.4511764838967496	3	2	4	2	0	0	0	0.16666666666666666	0.2222222222222222	0.1111111111111111	3	2	0	1	0	3	1	2	1	0	0	0	0.3333333333333333	0.2222222222222222	0.1111111111111111	1	0	0	0	0
3906	3915	Здание основного храма имеет два портала, один на юге, второй на западе (основной).	Украшение изобилует лепниной, особенно вокруг окон и купола,	preparation_r	13	5.461538461538462	1	12	1	5.461538461538462	0.9230769230769231	8	6.625	1	8	1	6.625	1.0	0.5902705017792128	5	1	3	0	0	2	0	0.38461538461538464	0.23076923076923078	0.07692307692307693	2	0	0	0	0	4	1	0	1	0	0	0	0.5	0.0	0.125	1	1	0	0	0
3907	3916	Украшение изобилует лепниной, особенно вокруг окон и купола,	Ква по-грузински означает камень, хеви - ущелье,	joint_m	8	6.625	1	8	1	6.625	1.0	7	6.0	1	7	1	6.0	1.0	0.665027773385289	4	1	0	1	0	0	0	0.5	0.0	0.125	1	1	0	0	0	2	1	0	1	0	0	0	0.2857142857142857	0.0	0.14285714285714285	0	0	0	0	0
3908	3917	восточный фасад украшен большим витиеватым крестом.	Украшение изобилует лепниной, особенно вокруг окон и купола,	joint_m	6	7.666666666666667	0	6	0	7.666666666666667	1.0	8	6.625	1	8	1	6.625	1.0	0.7187952884282609	2	1	3	0	0	0	0	0.3333333333333333	0.5	0.16666666666666666	0	0	0	0	0	4	1	0	1	0	0	0	0.5	0.0	0.125	1	1	0	0	0
3909	3918	Эта, со слов настоятеля, рубашка храма покрыта более поздними орнаментами, предположительно XVII века,	Украшение изобилует лепниной, особенно вокруг окон и купола,	elaboration_r	13	6.923076923076923	1	13	1	6.923076923076923	1.0	8	6.625	1	8	1	6.625	1.0	0.46229575895674435	6	1	1	2	0	1	0	0.46153846153846156	0.07692307692307693	0.07692307692307693	1	0	0	0	0	4	1	0	1	0	0	0	0.5	0.0	0.125	1	1	0	0	0
3910	3919	она заметно отличается по цвету.	Эта, со слов настоятеля, рубашка храма покрыта более поздними орнаментами, предположительно XVII века,	evidence_r	5	5.6	0	5	0	5.6	1.0	13	6.923076923076923	1	13	1	6.923076923076923	1.0	0.5332107702308685	1	1	0	1	0	0	0	0.2	0.0	0.2	1	0	0	0	1	6	1	1	2	0	1	0	0.46153846153846156	0.07692307692307693	0.07692307692307693	1	0	0	0	0
3911	3920	К XVII веку относятся и более поздние постройки комплекса, такие как колокольня.	Эта, со слов настоятеля, рубашка храма покрыта более поздними орнаментами, предположительно XVII века,	sequence_m	12	5.75	1	12	1	5.75	1.0	13	6.923076923076923	1	13	1	6.923076923076923	1.0	0.8224783208299743	4	1	1	1	0	1	0	0.3333333333333333	0.08333333333333333	0.08333333333333333	1	0	1	1	0	6	1	1	2	0	1	0	0.46153846153846156	0.07692307692307693	0.07692307692307693	1	0	0	0	0
3912	3921	Монастырь подвергся сильному разрушению во время одного из набегов Тамерлана (около 1400 года).	Про то, что на каменном полу, под коврами, находятся вгоревшие от топившегося жира следы человеческих костей, в которых легко различаются позвонки и тазобедренные суставы, не упоминается ни в одном отчете о монастыре.	preparation_r	13	6.384615384615385	2	13	2	6.384615384615385	1.0	32	5.8125	1	31	1	5.8125	0.96875	0.6221710168382552	5	1	1	0	0	2	0	0.38461538461538464	0.07692307692307693	0.07692307692307693	3	0	0	0	0	9	5	3	1	0	1	0	0.28125	0.09375	0.15625	7	1	1	2	2
