level_0	index	EDU_1	EDU_2	Relation	num_of_words_1	avg_word_len_1	upcase_words_num_1	num_unique_words_1	count_words_title_1	mean_word_len_1	words_vs_unique_1	num_of_words_2	avg_word_len_2	upcase_words_num_2	num_unique_words_2	count_words_title_2	mean_word_len_2	words_vs_unique_2	bleu_score	nouns_count_1	verbs_count_1	adj_count_1	adv_count_1	aux_count_1	num_count_1	vbd_count_1	nouns_vs_words_1	adjectives_vs_words_1	verbs_vs_words_1	adp_count_1	cconj_count_1	sconj_count_1	part_count_1	pron_count_1	nouns_count_2	verbs_count_2	adj_count_2	adv_count_2	aux_count_2	num_count_2	vbd_count_2	nouns_vs_words_2	adjectives_vs_words_2	verbs_vs_words_2	adp_count_2	cconj_count_2	sconj_count_2	part_count_2	pron_count_2
5367	5379	Я три года проходила с длинными волосами в режиме бесперебойного отращивания,	поэтому мне это просто надоело.	cause_r	11	6.090909090909091	1	11	1	6.090909090909091	1.0	5	5.4	0	5	0	5.4	1.0	0.20766765264729506	4	1	2	0	0	1	0	0.36363636363636365	0.18181818181818182	0.09090909090909091	2	0	0	0	1	0	1	0	1	0	0	0	0.0	0.0	0.2	0	0	0	1	2
5368	5380	поэтому мне это просто надоело.	И с такими мыслями я решаюсь на стрижку боб-каре.	cause_r	5	5.4	0	5	0	5.4	1.0	9	4.555555555555555	1	9	1	4.555555555555555	1.0	0.6060915267313265	0	1	0	1	0	0	0	0.0	0.0	0.2	0	0	0	1	2	3	1	0	0	0	0	0	0.3333333333333333	0.0	0.1111111111111111	2	1	0	0	1
5369	5381	И да, я устала от длины,	захотелось перемен.	cause_r	6	3.1666666666666665	1	6	1	3.1666666666666665	1.0	2	9.0	0	2	0	9.0	1.0	0.46653496497321506	1	1	0	0	0	0	0	0.16666666666666666	0.0	0.16666666666666666	1	1	0	1	1	1	1	0	0	0	0	0	0.5	0.0	0.5	0	0	0	0	0
5370	5382	захотелось перемен.	поэтому мне это просто надоело.	joint_m	2	9.0	0	2	0	9.0	1.0	5	5.4	0	5	0	5.4	1.0	0.672021505032247	1	1	0	0	0	0	0	0.5	0.0	0.5	0	0	0	0	0	0	1	0	1	0	0	0	0.0	0.0	0.2	0	0	0	1	2
5371	5383	И с такими мыслями я решаюсь на стрижку боб-каре.	Теперь волосы требовали еще меньше ухода с моей стороны.	elaboration_r	9	4.555555555555555	1	9	1	4.555555555555555	1.0	9	5.333333333333333	1	9	1	5.333333333333333	1.0	0.7559289460184544	3	1	0	0	0	0	0	0.3333333333333333	0.0	0.1111111111111111	2	1	0	0	1	3	1	0	2	0	1	0	0.3333333333333333	0.0	0.1111111111111111	1	0	0	0	0
5372	5384	Как люблю я говорить, подлецу все к лицу, даже такие изменения.	И с такими мыслями я решаюсь на стрижку боб-каре.	elaboration_r	11	4.818181818181818	1	11	1	4.818181818181818	1.0	9	4.555555555555555	1	9	1	4.555555555555555	1.0	0.6441233940645308	3	2	0	0	0	0	0	0.2727272727272727	0.0	0.18181818181818182	1	0	1	1	2	3	1	0	0	0	0	0	0.3333333333333333	0.0	0.1111111111111111	2	1	0	0	1
5373	5385	Уход остается прежним.	И с такими мыслями я решаюсь на стрижку боб-каре.	joint_m	3	6.666666666666667	1	3	1	6.666666666666667	1.0	9	4.555555555555555	1	9	1	4.555555555555555	1.0	0.5890150893739515	1	1	1	0	0	0	0	0.3333333333333333	0.3333333333333333	0.3333333333333333	0	0	0	0	0	3	1	0	0	0	0	0	0.3333333333333333	0.0	0.1111111111111111	2	1	0	0	1
5374	5386	Если меняться,	то по полной программе.	condition_r	2	6.5	1	2	1	6.5	1.0	4	5.0	0	4	0	5.0	1.0	0.5107539184552492	0	1	0	0	0	0	0	0.0	0.0	0.5	0	0	1	0	0	1	0	1	0	0	0	0	0.25	0.25	0.0	1	0	1	0	0
5375	5387	то по полной программе.	Что мы имеем: короткие волосы, 1см отросших родных корней, 7 см волос, окрашенных только хной и оставшаяся часть длины под хной и басмой, черной, непробиваемой, не смывающейся.	preparation_r	4	5.0	0	4	0	5.0	1.0	27	5.555555555555555	1	25	1	5.555555555555555	0.9259259259259259	0.3454246398538787	1	0	1	0	0	0	0	0.25	0.25	0.0	1	0	1	0	0	10	5	4	0	0	1	0	0.37037037037037035	0.14814814814814814	0.18518518518518517	1	2	0	2	2
5376	5388	Что мы имеем: короткие волосы, 1см отросших родных корней, 7 см волос, окрашенных только хной и оставшаяся часть длины под хной и басмой, черной, непробиваемой, не смывающейся.	Помимо черного цвета я обожаю красно-малиновые оттенки волос.	background_r	27	5.555555555555555	1	25	1	5.555555555555555	0.9259259259259259	8	6.75	1	8	1	6.75	1.0	0.145437768995806	10	5	4	0	0	1	0	0.37037037037037035	0.14814814814814814	0.18518518518518517	1	2	0	2	2	3	1	2	0	0	0	0	0.375	0.25	0.125	1	0	0	0	1
5377	5389	Такой оттенок с огромным трудом можно добиться,	Помимо черного цвета я обожаю красно-малиновые оттенки волос.	elaboration_r	7	5.857142857142857	1	7	1	5.857142857142857	1.0	8	6.75	1	8	1	6.75	1.0	0.7892723355548015	2	1	1	1	0	0	0	0.2857142857142857	0.14285714285714285	0.14285714285714285	1	0	0	0	0	3	1	2	0	0	0	0	0.375	0.25	0.125	1	0	0	0	1
5378	5390	окрашиваясь травами, и то, с сильным затемнением.	Такой оттенок с огромным трудом можно добиться,	condition_r	7	6.142857142857143	0	7	0	6.142857142857143	1.0	7	5.857142857142857	1	7	1	5.857142857142857	1.0	0.7656514020653881	2	1	1	0	0	0	0	0.2857142857142857	0.14285714285714285	0.14285714285714285	1	1	0	0	1	2	1	1	1	0	0	0	0.2857142857142857	0.14285714285714285	0.14285714285714285	1	0	0	0	0
5379	5391	А мне захотелось яркости.	Помимо черного цвета я обожаю красно-малиновые оттенки волос.	contrast_m	4	5.5	1	4	1	5.5	1.0	8	6.75	1	8	1	6.75	1.0	0.5867386940384682	1	1	0	0	0	0	0	0.25	0.0	0.25	0	1	0	0	1	3	1	2	0	0	0	0	0.375	0.25	0.125	1	0	0	0	1
5380	5392	В моем случае без обесцвечивания не обойтись. Порошком и 3% оксигентом 2 раза и порошком и 1,8% оксигентом один раз.	А мне захотелось яркости.	elaboration_r	20	4.85	2	17	2	4.85	0.85	4	5.5	1	4	1	5.5	1.0	0.025180363750298966	8	1	0	0	0	4	0	0.4	0.0	0.05	2	3	0	1	0	1	1	0	0	0	0	0	0.25	0.0	0.25	0	1	0	0	1
5381	5393	Все это по длине, там, где была хна с басмой.	В моем случае без обесцвечивания не обойтись. Порошком и 3% оксигентом 2 раза и порошком и 1,8% оксигентом один раз.	elaboration_r	10	3.6	1	10	1	3.6	1.0	20	4.85	2	17	2	4.85	0.85	0.5798335076138013	3	1	0	2	0	0	0	0.3	0.0	0.1	2	0	0	0	1	8	1	0	0	0	4	0	0.4	0.0	0.05	2	3	0	1	0
5382	5394	Корни обесцвечивали на 1,8%,	В моем случае без обесцвечивания не обойтись. Порошком и 3% оксигентом 2 раза и порошком и 1,8% оксигентом один раз.	joint_m	4	6.25	1	4	1	6.25	1.0	20	4.85	2	17	2	4.85	0.85	0.4734320764739993	1	1	0	0	0	1	0	0.25	0.0	0.25	1	0	0	0	0	8	1	0	0	0	4	0	0.4	0.0	0.05	2	3	0	1	0
5383	5395	но в сложившейся ситуации можно было бы обойтись и без чистки корней. Порошочек и оксиды фирм Bouticle и Tefia (оксид 1,8%).	Корни обесцвечивали на 1,8%,	contrast_m	21	4.9523809523809526	3	19	3	4.9523809523809526	0.9047619047619048	4	6.25	1	4	1	6.25	1.0	0.030646532006956755	7	2	0	1	1	1	0	0.3333333333333333	0.0	0.09523809523809523	2	3	0	2	0	1	1	0	0	0	1	0	0.25	0.0	0.25	1	0	0	0	0
5384	5396	При смывании пудры	я поразилась тому, что мои волосы не были убитыми.	condition_r	3	5.333333333333333	1	3	1	5.333333333333333	1.0	9	4.666666666666667	0	9	0	4.666666666666667	1.0	0.5477225575051661	2	0	0	0	0	0	0	0.6666666666666666	0.0	0.0	1	0	0	0	0	1	2	0	0	1	0	0	0.1111111111111111	0.0	0.2222222222222222	0	0	1	1	2
5385	5397	я поразилась тому, что мои волосы не были убитыми.	В моем случае без обесцвечивания не обойтись. Порошком и 3% оксигентом 2 раза и порошком и 1,8% оксигентом один раз.	sequence_m	9	4.666666666666667	0	9	0	4.666666666666667	1.0	20	4.85	2	17	2	4.85	0.85	0.6158817620514396	1	2	0	0	1	0	0	0.1111111111111111	0.0	0.2222222222222222	0	0	1	1	2	8	1	0	0	0	4	0	0.4	0.0	0.05	2	3	0	1	0
5386	5398	Пальцы проходили сквозь волосы не застревая и не выдирая их.	я поразилась тому, что мои волосы не были убитыми.	elaboration_r	10	5.1	1	9	1	5.1	0.9	9	4.666666666666667	0	9	0	4.666666666666667	1.0	0.7137529229271751	2	3	0	0	0	0	0	0.2	0.0	0.3	1	1	0	2	1	1	2	0	0	1	0	0	0.1111111111111111	0.0	0.2222222222222222	0	0	1	1	2
5387	5399	Фантастика да и только.	я поразилась тому, что мои волосы не были убитыми.	evaluation_r	4	5.0	1	4	1	5.0	1.0	9	4.666666666666667	0	9	0	4.666666666666667	1.0	0.5830951894845301	1	0	0	0	0	0	0	0.25	0.0	0.0	0	1	0	2	0	1	2	0	0	1	0	0	0.1111111111111111	0.0	0.2222222222222222	0	0	1	1	2
5388	5400	Что до цвета, то хна обесцветилась до желто-оранжевого цвета, а басма — сине-зеленое безобразие.	я поразилась тому, что мои волосы не были убитыми.	joint_m	14	5.928571428571429	1	12	1	5.928571428571429	0.8571428571428571	9	4.666666666666667	0	9	0	4.666666666666667	1.0	0.3474208454328262	5	1	2	0	0	0	0	0.35714285714285715	0.14285714285714285	0.07142857142857142	2	1	1	0	1	1	2	0	0	1	0	0	0.1111111111111111	0.0	0.2222222222222222	0	0	1	1	2
5389	5401	вокруг которой ведутся жаркие дебаты как мастеров, так и простых обывателей.	Выход из хны и басмы путем обесцвечивания — весьма неоднозначная тема,	elaboration_r	11	6.0	0	11	0	6.0	1.0	11	5.454545454545454	1	11	1	5.454545454545454	1.0	0.7679337921538159	3	1	2	1	0	0	0	0.2727272727272727	0.18181818181818182	0.09090909090909091	1	0	1	1	1	5	0	1	1	0	0	0	0.45454545454545453	0.09090909090909091	0.0	2	1	0	0	0
5390	5402	Многие из вас, наверно, слышали, что обесцвечивание хны дает зелень,	Выход из хны и басмы путем обесцвечивания — весьма неоднозначная тема,	elaboration_r	10	5.9	1	10	1	5.9	1.0	11	5.454545454545454	1	11	1	5.454545454545454	1.0	0.8783100656536799	3	2	0	1	0	1	0	0.3	0.0	0.2	1	0	1	0	1	5	0	1	1	0	0	0	0.45454545454545453	0.09090909090909091	0.0	2	1	0	0	0
5391	5403	после хны невозможно стать блондинкой\получить холодный блонд, и т.д.	Многие из вас, наверно, слышали, что обесцвечивание хны дает зелень,	joint_m	9	6.777777777777778	0	9	0	6.777777777777778	1.0	10	5.9	1	10	1	5.9	1.0	0.7651574100210662	2	2	2	1	0	0	0	0.2222222222222222	0.2222222222222222	0.2222222222222222	1	1	0	0	0	3	2	0	1	0	1	0	0.3	0.0	0.2	1	0	1	0	1
5392	5404	Отчасти, это правда, отчасти — бред больной души.	Многие из вас, наверно, слышали, что обесцвечивание хны дает зелень,	evaluation_r	8	5.25	1	8	1	5.25	1.0	10	5.9	1	10	1	5.9	1.0	0.7174300539794393	3	0	1	2	0	0	0	0.375	0.125	0.0	0	0	0	0	1	3	2	0	1	0	1	0	0.3	0.0	0.2	1	0	1	0	1
5393	5405	Если будет время,	напишу об этом отдельный пост.	condition_r	3	5.0	1	3	1	5.0	1.0	5	5.2	0	5	0	5.2	1.0	0.6055300708194984	1	1	0	0	0	0	0	0.3333333333333333	0.0	0.3333333333333333	0	0	1	0	0	1	1	1	0	0	0	0	0.2	0.2	0.2	1	0	0	0	1
5394	5406	напишу об этом отдельный пост.	Многие из вас, наверно, слышали, что обесцвечивание хны дает зелень,	elaboration_r	5	5.2	0	5	0	5.2	1.0	10	5.9	1	10	1	5.9	1.0	0.568796458994521	1	1	1	0	0	0	0	0.2	0.2	0.2	1	0	0	0	1	3	2	0	1	0	1	0	0.3	0.0	0.2	1	0	1	0	1
5395	5407	После всех очищающих цвет манипуляций покрасили волосы красителем Bouticle 8.55 по длине и 7.55 на корнях.	я ощутила колоссальную разницу между тем, какими были волосы после смывания пудры и какими сейчас.	preparation_r	16	5.6875	2	16	2	5.6875	1.0	15	5.6	0	14	0	5.6	0.9333333333333333	0.8115983352292281	6	2	0	0	0	2	0	0.375	0.0	0.125	3	1	0	0	0	4	1	1	1	1	0	0	0.26666666666666666	0.06666666666666667	0.06666666666666667	2	1	0	0	2
5396	5408	Уже при смывании краски с волос	я ощутила колоссальную разницу между тем, какими были волосы после смывания пудры и какими сейчас.	condition_r	6	4.333333333333333	1	6	1	4.333333333333333	1.0	15	5.6	0	14	0	5.6	0.9333333333333333	0.5532833351724881	3	0	0	1	0	0	0	0.5	0.0	0.0	2	0	0	0	0	4	1	1	1	1	0	0	0.26666666666666666	0.06666666666666667	0.06666666666666667	2	1	0	0	2
5397	5409	Пальцы с трудом проходили сквозь спутанные дебри волос,	а я все яснее и яснее понимала, что окрашивание перманентом было явно лишним.	cause_r	8	6.0	1	8	1	6.0	1.0	13	5.0	0	12	0	5.0	0.9230769230769231	0.7297037292405271	4	2	0	0	0	0	0	0.5	0.0	0.25	2	0	0	0	0	2	1	1	3	1	0	0	0.15384615384615385	0.07692307692307693	0.07692307692307693	0	2	1	1	1
5398	5410	а я все яснее и яснее понимала, что окрашивание перманентом было явно лишним.	я ощутила колоссальную разницу между тем, какими были волосы после смывания пудры и какими сейчас.	elaboration_r	13	5.0	0	12	0	5.0	0.9230769230769231	15	5.6	0	14	0	5.6	0.9333333333333333	0.8017837257372732	2	1	1	3	1	0	0	0.15384615384615385	0.07692307692307693	0.07692307692307693	0	2	1	1	1	4	1	1	1	1	0	0	0.26666666666666666	0.06666666666666667	0.06666666666666667	2	1	0	0	2
5399	5411	Но дело сделано,	а я все яснее и яснее понимала, что окрашивание перманентом было явно лишним.	contrast_m	3	4.666666666666667	1	3	1	4.666666666666667	1.0	13	5.0	0	12	0	5.0	0.9230769230769231	0.41089070180665904	1	1	0	0	0	0	0	0.3333333333333333	0.0	0.3333333333333333	0	1	0	0	0	2	1	1	3	1	0	0	0.15384615384615385	0.07692307692307693	0.07692307692307693	0	2	1	1	1
5400	5412	теперь моя задача ухаживать за поврежденными волосами,	Но дело сделано,	elaboration_r	7	6.857142857142857	0	7	0	6.857142857142857	1.0	3	4.666666666666667	1	3	1	4.666666666666667	1.0	0.08700708765802104	2	2	0	1	0	0	0	0.2857142857142857	0.0	0.2857142857142857	1	0	0	0	0	1	1	0	0	0	0	0	0.3333333333333333	0.0	0.3333333333333333	0	1	0	0	0
5401	5413	стараясь поддерживать цвет и качество волос на должном уровне.	теперь моя задача ухаживать за поврежденными волосами,	condition_r	9	6.0	0	9	0	6.0	1.0	7	6.857142857142857	0	7	0	6.857142857142857	1.0	0.7694801564819707	4	2	1	0	0	0	0	0.4444444444444444	0.1111111111111111	0.2222222222222222	1	1	0	0	0	2	2	0	1	0	0	0	0.2857142857142857	0.0	0.2857142857142857	1	0	0	0	0
5402	5414	такими я хочу их видеть	Я привыкла к блеску, упругости и мягкости волос,	elaboration_r	5	3.8	0	5	0	3.8	1.0	8	5.125	1	8	1	5.125	1.0	0.6123724356957946	0	2	0	0	0	0	0	0.0	0.0	0.4	0	0	0	0	2	4	1	0	0	0	0	0	0.5	0.0	0.125	1	1	0	0	1
5403	5415	и ощущать даже после тройного обесцвечивания.	такими я хочу их видеть	joint_m	6	6.666666666666667	0	6	0	6.666666666666667	1.0	5	3.8	0	5	0	3.8	1.0	0.339907088393765	1	1	1	0	0	0	0	0.16666666666666666	0.16666666666666666	0.16666666666666666	1	1	0	1	0	0	2	0	0	0	0	0	0.0	0.0	0.4	0	0	0	0	2
5404	5416	Вы можете сказать мне что-то вроде: «Ты же обесцветилась,	испортила волосы,	cause_r	9	5.444444444444445	2	9	2	5.444444444444445	1.0	2	8.0	0	2	0	8.0	1.0	0.08629193108574455	0	3	0	0	0	0	0	0.0	0.0	0.3333333333333333	1	0	0	1	4	1	1	0	0	0	0	0	0.5	0.0	0.5	0	0	0	0	0
5405	5417	испортила волосы,	вот и терпи теперь,	cause_r	2	8.0	0	2	0	8.0	1.0	4	4.0	0	4	0	4.0	1.0	0.6882472016116853	1	1	0	0	0	0	0	0.5	0.0	0.5	0	0	0	0	0	0	1	0	1	0	0	0	0.0	0.0	0.25	0	0	0	2	0
5406	5418	вот и терпи теперь,	Я привыкла к блеску, упругости и мягкости волос,	elaboration_r	4	4.0	0	4	0	4.0	1.0	8	5.125	1	8	1	5.125	1.0	0.5590169943749475	0	1	0	1	0	0	0	0.0	0.0	0.25	0	0	0	2	0	4	1	0	0	0	0	0	0.5	0.0	0.125	1	1	0	0	1
5407	5419	срезай	вот и терпи теперь,	joint_m	1	6.0	0	1	0	6.0	1.0	4	4.0	0	4	0	4.0	1.0	0.32444284226152503	0	1	0	0	0	0	0	0.0	0.0	1.0	0	0	0	0	0	0	1	0	1	0	0	0	0.0	0.0	0.25	0	0	0	2	0
5408	5420	и отращивай натуральный цвет»,-	вот и терпи теперь,	joint_m	4	7.0	0	4	0	7.0	1.0	4	4.0	0	4	0	4.0	1.0	0.47247363317928565	1	1	1	0	0	0	0	0.25	0.25	0.25	0	1	0	0	0	0	1	0	1	0	0	0	0.0	0.0	0.25	0	0	0	2	0
5409	5421	и будете вкорне не правы)	вот и терпи теперь,	evaluation_r	5	4.2	0	5	0	4.2	1.0	4	4.0	0	4	0	4.0	1.0	0.6031832178533021	0	0	1	1	1	0	0	0.0	0.2	0.0	0	1	0	1	0	0	1	0	1	0	0	0	0.0	0.0	0.25	0	0	0	2	0
5410	5422	Поскольку даже такие волосы имеют возможность «восстать из пепла, подобно прекрасному фениксу».	и будете вкорне не правы)	cause_r	12	7.0	1	12	1	7.0	1.0	5	4.2	0	5	0	4.2	1.0	0.059581449863389646	4	2	1	0	0	0	0	0.3333333333333333	0.08333333333333333	0.16666666666666666	2	0	1	1	0	0	0	1	1	1	0	0	0.0	0.2	0.0	0	1	0	1	0
5411	5423	поскольку ярко-красный такой же капризный и недолговечный, как пепельный блонд.	Теперь мне нужен совсем иной уход для волос+ постоянное тонирование,	cause_r	10	7.0	0	10	0	7.0	1.0	10	5.9	1	10	1	5.9	1.0	0.714681669423469	1	0	4	0	0	0	0	0.1	0.4	0.0	0	1	2	1	0	2	0	3	2	0	0	0	0.2	0.3	0.0	1	0	0	0	1
5412	5424	Но из-за того, что мои волосы обесцвечены три раза подряд,	я решила перейти на прямые пигменты,	cause_r	10	4.9	1	10	1	4.9	1.0	6	5.166666666666667	0	6	0	5.166666666666667	1.0	0.4700331065282323	2	1	0	1	0	1	0	0.2	0.0	0.1	1	1	1	0	1	1	2	1	0	0	0	0	0.16666666666666666	0.16666666666666666	0.3333333333333333	1	0	0	0	1
5413	5425	и после последующего тонирования стали намного хуже себя чувствовать,	Но из-за того, что мои волосы обесцвечены три раза подряд,	joint_m	9	6.777777777777778	0	9	0	6.777777777777778	1.0	10	4.9	1	10	1	4.9	1.0	0.7122853895645077	1	2	1	2	0	0	0	0.1111111111111111	0.1111111111111111	0.2222222222222222	1	1	0	0	1	2	1	0	1	0	1	0	0.2	0.0	0.1	1	1	1	0	1
5414	5426	я решила перейти на прямые пигменты,	Теперь мне нужен совсем иной уход для волос+ постоянное тонирование,	contrast_m	6	5.166666666666667	0	6	0	5.166666666666667	1.0	10	5.9	1	10	1	5.9	1.0	0.6530471562110152	1	2	1	0	0	0	0	0.16666666666666666	0.16666666666666666	0.3333333333333333	1	0	0	0	1	2	0	3	2	0	0	0	0.2	0.3	0.0	1	0	0	0	1
5415	5427	это такие красители, которые продаются в готовом виде,	я решила перейти на прямые пигменты,	elaboration_r	8	5.875	0	8	0	5.875	1.0	6	5.166666666666667	0	6	0	5.166666666666667	1.0	0.5154519449111705	2	1	1	0	0	0	0	0.25	0.125	0.125	1	0	0	0	2	1	2	1	0	0	0	0	0.16666666666666666	0.16666666666666666	0.3333333333333333	1	0	0	0	1
5416	5428	их не нужно смешивать.	это такие красители, которые продаются в готовом виде,	joint_m	4	4.75	0	4	0	4.75	1.0	8	5.875	0	8	0	5.875	1.0	0.49065338146265813	0	1	1	0	0	0	0	0.0	0.25	0.25	0	0	0	1	1	2	1	1	0	0	0	0	0.25	0.125	0.125	1	0	0	0	2
5417	5429	Они отлично ложатся на обесцвеченные волосы,	я решила перейти на прямые пигменты,	elaboration_r	6	6.5	1	6	1	6.5	1.0	6	5.166666666666667	0	6	0	5.166666666666667	1.0	0.6259652223535133	1	2	0	1	0	0	0	0.16666666666666666	0.0	0.3333333333333333	1	0	0	0	1	1	2	1	0	0	0	0	0.16666666666666666	0.16666666666666666	0.3333333333333333	1	0	0	0	1
5418	5430	но на натуральные могут не лечь.	Они отлично ложатся на обесцвеченные волосы,	contrast_m	6	4.5	0	6	0	4.5	1.0	6	6.5	1	6	1	6.5	1.0	0.7229988054812212	0	2	1	0	0	0	0	0.0	0.16666666666666666	0.3333333333333333	1	1	0	1	0	1	2	0	1	0	0	0	0.16666666666666666	0.0	0.3333333333333333	1	0	0	0	1
5419	5431	На фото: слева пигмент прямого действия Kapous Professional Rain Bow (красный), оттеночный бальзам Kapous Professional Life Color (гранат), оттеночная маска Tefia (красный), эти три тюбика у меня закончились. Справа еще не открытые средства: оттеночная маска Ollin Matisse Color (гранат), пигмент прямого действия Estel X-tro (розовый) и пигмент прямого действия Ollin Matisse Color (красный), открою буквально на днях, поскольку подходит время для очередного обесцвечивания корней и тонирования.	Теперь мне нужен совсем иной уход для волос+ постоянное тонирование,	elaboration_r	66	6.53030303030303	18	48	18	6.53030303030303	0.7272727272727273	10	5.9	1	10	1	5.9	1.0	0.0018059331057135568	19	3	12	4	0	1	0	0.2878787878787879	0.18181818181818182	0.045454545454545456	4	2	1	1	1	2	0	3	2	0	0	0	0.2	0.3	0.0	1	0	0	0	1
5420	5432	для смягчения воздействия на волосы или разбавления цвета.	Эти красители можно смешивать с кондиционером или маской	purpose_r	8	6.375	0	8	0	6.375	1.0	8	6.125	1	8	1	6.125	1.0	0.7843254933044702	5	0	0	0	0	0	0	0.625	0.0	0.0	2	1	0	0	0	3	1	0	1	0	0	0	0.375	0.0	0.125	1	1	0	0	0
5421	5433	Но я стремлюсь добиться максимальной яркости и насыщенности цвета,	использую пигменты в чистом виде.	cause_r	9	6.444444444444445	1	9	1	6.444444444444445	1.0	5	5.8	0	5	0	5.8	1.0	0.3201979539670836	3	2	1	0	0	0	0	0.3333333333333333	0.1111111111111111	0.2222222222222222	0	2	0	0	1	2	1	1	0	0	0	0	0.4	0.2	0.2	1	0	0	0	0
5422	5434	использую пигменты в чистом виде.	Эти красители можно смешивать с кондиционером или маской	contrast_m	5	5.8	0	5	0	5.8	1.0	8	6.125	1	8	1	6.125	1.0	0.6408699444616558	2	1	1	0	0	0	0	0.4	0.2	0.2	1	0	0	0	0	3	1	0	1	0	0	0	0.375	0.0	0.125	1	1	0	0	0
5423	5435	В моем арсенале красные и розовые(фуксия) оттенки,	использую пигменты в чистом виде.	elaboration_r	7	6.285714285714286	1	7	1	6.285714285714286	1.0	5	5.8	0	5	0	5.8	1.0	0.49874607129084286	3	0	2	0	0	0	0	0.42857142857142855	0.2857142857142857	0.0	1	1	0	0	0	2	1	1	0	0	0	0	0.4	0.2	0.2	1	0	0	0	0
5424	5436	я их чередую,	В моем арсенале красные и розовые(фуксия) оттенки,	elaboration_r	3	3.6666666666666665	0	3	0	3.6666666666666665	1.0	7	6.285714285714286	1	7	1	6.285714285714286	1.0	0.4242640687119285	0	1	0	0	0	0	0	0.0	0.0	0.3333333333333333	0	0	0	0	2	3	0	2	0	0	0	0	0.42857142857142855	0.2857142857142857	0.0	1	1	0	0	0
5425	5437	меняться прикольно, кстати,	никогда не соскучишься)	cause_r	3	8.333333333333334	0	3	0	8.333333333333334	1.0	3	7.0	0	3	0	7.0	1.0	0.7009170076520224	0	1	1	1	0	0	0	0.0	0.3333333333333333	0.3333333333333333	0	0	0	0	0	0	1	0	1	0	0	0	0.0	0.0	0.3333333333333333	0	0	0	1	0
5426	5438	никогда не соскучишься)	я их чередую,	evaluation_r	3	7.0	0	3	0	7.0	1.0	3	3.6666666666666665	0	3	0	3.6666666666666665	1.0	0.36349683934014515	0	1	0	1	0	0	0	0.0	0.0	0.3333333333333333	0	0	0	1	0	0	1	0	0	0	0	0	0.0	0.0	0.3333333333333333	0	0	0	0	2
5427	5439	А каждые месяц-полтора я прохожусь по корням обесцвечивающей пудрой, замешанной на 1,5% оксигенте,	Эти красители можно смешивать с кондиционером или маской	joint_m	13	6.615384615384615	1	13	1	6.615384615384615	1.0	8	6.125	1	8	1	6.125	1.0	0.42811854514065734	3	3	0	0	0	2	0	0.23076923076923078	0.0	0.23076923076923078	2	1	0	0	1	3	1	0	1	0	0	0	0.375	0.0	0.125	1	1	0	0	0
